Name,Street Address,City,State,Zip Code,Cross Streets,Neighborhood,Phone,Description,Business Owner,Merchant Verified,Paid Listing,Rating,Reviews,Website,Price Range,Hours,Takes Reservations,Delivery,Take Out,Accepts Credit Cards,Good For,Parking,Wheelchair Accessable,Good For Kids,Good For Groups,Attire,Ambience,Noise Level,Music,Dancing,Serves Alcohol,Happy Hour,Best Nights,Coat Check,Smoking Allowed,Outdoor Seating,Wifi,Has Tv,Allows Dogs,Waiter Service,Caters,By Appointment Only,Category,Lat,Long,Image URL,Listing URL,Deal,Deal Description,Deal Orignal Price,Deal Discount,Deal Savings,Deal Link,Email from Web,Facebook URL,Twitter URL,Google Plus URL
PDI Chicago,2444 Pulaski Rd,Chicago,IL,60639,b/t Fullerton Ave & Altgeld St,Logan Square,(312) 971-4317,,,No,No,,,http://www.pdichicago.com,,,,,,No,,,,,,,,,,,,,,,,,,,,,,,"Signmaking, Awnings, Signmaking, Awnings",41.925971,-87.727351,"https://s3-media3.fl.yelpcdn.com/bphoto/rTVu5tofOKH17khXUz-5AA/ls.jpg"" srcset=""https://s3-media3.fl.yelpcdn.com/bphoto/rTVu5tofOKH17khXUz-5AA/258s.jpg 1.03x,https://s3-media3.fl.yelpcdn.com/bphoto/rTVu5tofOKH17khXUz-5AA/348s.jpg 1.39x,https://s3-media3.fl.yelpcdn.com/bphoto/rTVu5tofOKH17khXUz-5AA/300s.jpg 1.20x",http://www.yelp.com/biz/pdi-chicago-chicago?osq=Signmaking,,,,,,,,,,
FedEx Office Print & Ship Center,1720 N Harlem Ave,Elmwood Park,IL,60707,,Galewood,(708) 453-0009,"FedEx Office in Elmwood Park, IL provides a one-stop shop for small businesses printing and shipping expertise and reliable customer service when and where you need it. Services …Learn more about FedEx Office Print & Ship Center, Opens a popupSpecialtiesFedEx Office in Elmwood Park, IL provides a one-stop shop for small businesses printing and shipping expertise and reliable customer service when and where you need it. Services include copying and digital printing, direct mail, signs and graphics, Internet access, computer rental, fax services, passport photos, FedEx Express and FedEx Ground shipping.Upload documents with FedEx Office Print Online, and have your flyers, brochures, presentations or signs ready for convenient pick-up or delivery.FedEx Kinko's is now FedEx Office.HistoryEstablished in 1970.FedEx Office (formerly FedEx Kinko's) provides access points to printing and shipping expertise with reliable service when and where you need it. The Dallas-based company has a network of more than 1,900 digitally-connected locations.FedEx Office services include copying and digital printing, professional finishing, document creation, direct mail, signs and graphics, Internet access, computer rental, FedEx Express and FedEx Ground shipping, and more.In addition, the company offers FedEx Office Print Online, an online printing solution for business and personal printing, at home, at the office or on the go.More than 200 locations operate 24 hours a day every day of the week.",,Yes,No,2.5 star rating,24 reviews,http://local.fedex.com/il/elmwood-park/office-3616/%3Fcmp%3DLOC-1001545-3-1-971-1110000-US-US-EN-YEXTLISTFXOPRSC,,Mon Open 24 hours<br>Tue Open 24 hours<br>Wed Open 24 hours<br>Thu Open 24 hours<br>Fri Open 24 hours<br>Sat Open 24 hours<br>Sun Open 24 hours<br>,,,,Yes,,,,,,,,,,,,,,,,,,,,,,,"Shipping Centers, Printing Services, Signmaking, Shipping Centers, Printing Services, Signmaking",41.911229,-87.806240,"https://s3-media4.fl.yelpcdn.com/bphoto/qEvAiAmNEYg73HWYvPPNBA/ls.jpg"" srcset=""https://s3-media4.fl.yelpcdn.com/bphoto/qEvAiAmNEYg73HWYvPPNBA/258s.jpg 1.03x,https://s3-media4.fl.yelpcdn.com/bphoto/qEvAiAmNEYg73HWYvPPNBA/348s.jpg 1.39x,https://s3-media4.fl.yelpcdn.com/bphoto/qEvAiAmNEYg73HWYvPPNBA/300s.jpg 1.20x",http://www.yelp.com/biz/fedex-office-print-and-ship-center-elmwood-park?osq=Signmaking,,,,,,,,,,
Omega Sign & Lighting,100 W Fay Ave,Addison,IL,60101,,,(630) 237-4397,,Carmela M.,Yes,No,5.0 star rating,1 review,http://www.omegasignchicago.com,,Mon 8:00 am - 5:00 pm<br>Tue 8:00 am - 5:00 pm<br>Wed 8:00 am - 5:00 pm<br>Thu 8:00 am - 5:00 pm<br>Fri 8:00 am - 5:00 pm<br>Sat Closed<br>Sun Closed<br>,,,,Yes,,,,,,,,,,,,,,,,,,,,,,Yes,"Signmaking, Lighting Fixtures & Equipment, Signmaking, Lighting Fixtures & Equipment",,,"https://s3-media1.fl.yelpcdn.com/bphoto/eDHAPK08aHUGihukP3tvtA/ls.jpg"" srcset=""https://s3-media1.fl.yelpcdn.com/bphoto/eDHAPK08aHUGihukP3tvtA/258s.jpg 1.03x,https://s3-media1.fl.yelpcdn.com/bphoto/eDHAPK08aHUGihukP3tvtA/348s.jpg 1.39x,https://s3-media1.fl.yelpcdn.com/bphoto/eDHAPK08aHUGihukP3tvtA/300s.jpg 1.20x",http://www.yelp.com/biz/omega-sign-and-lighting-addison-2?osq=Signmaking,,,,,,,Carmela@omegasignchicago.com,,,
FedEx Office Print & Ship Center,55 E Monroe St,Chicago,IL,60603,b/t Wabash Ave & Michigan Ave,The Loop,(312) 701-0730,"FedEx Office in Chicago, IL provides a one-stop shop for small businesses printing and shipping expertise and reliable customer service when and where you need it. Services include …Learn more about FedEx Office Print & Ship Center, Opens a popupSpecialtiesFedEx Office in Chicago, IL provides a one-stop shop for small businesses printing and shipping expertise and reliable customer service when and where you need it. Services include copying and digital printing, direct mail, signs and graphics, Internet access, computer rental, fax services, passport photos, FedEx Express and FedEx Ground shipping.Upload documents with FedEx Office Print Online, and have your flyers, brochures, presentations or signs ready for convenient pick-up or delivery.FedEx Kinko's is now FedEx Office.HistoryEstablished in 1970.FedEx Office (formerly FedEx Kinko's) provides access points to printing and shipping expertise with reliable service when and where you need it. The Dallas-based company has a network of more than 1,900 digitally-connected locations.FedEx Office services include copying and digital printing, professional finishing, document creation, direct mail, signs and graphics, Internet access, computer rental, FedEx Express and FedEx Ground shipping, and more.In addition, the company offers FedEx Office Print Online, an online printing solution for business and personal printing, at home, at the office or on the go.More than 200 locations operate 24 hours a day every day of the week.",,Yes,No,3.0 star rating,13 reviews,http://local.fedex.com/il/chicago/office-0352/%3Fcmp%3DLOC-1001545-3-1-971-1110000-US-US-EN-YEXTLISTFXOPRSC,,Mon 7:30 am - 9:00 pm<br>Tue 7:30 am - 9:00 pm<br>Wed 7:30 am - 9:00 pm<br>Thu 7:30 am - 9:00 pm<br>Fri 7:30 am - 9:00 pm<br>Sat Closed<br>Sun Closed<br>,,,,Yes,,,,,,,,,,,,,,,,,,,,,,,"Printing Services, Shipping Centers, Signmaking, Printing Services, Shipping Centers, Signmaking",41.880234,-87.625581,"https://s3-media4.fl.yelpcdn.com/bphoto/h_UdpUsEDsuDZm5PpvQKlQ/ls.jpg"" srcset=""https://s3-media4.fl.yelpcdn.com/bphoto/h_UdpUsEDsuDZm5PpvQKlQ/258s.jpg 1.03x,https://s3-media4.fl.yelpcdn.com/bphoto/h_UdpUsEDsuDZm5PpvQKlQ/348s.jpg 1.39x,https://s3-media4.fl.yelpcdn.com/bphoto/h_UdpUsEDsuDZm5PpvQKlQ/300s.jpg 1.20x",http://www.yelp.com/biz/fedex-office-print-and-ship-center-chicago-30?osq=Signmaking,,,,,,,,,,
FedEx Office Print & Ship Center,678 N Northwest Hwy,Park Ridge,IL,60068,b/t Lincoln Ave & Delphia Ave,,(847) 823-9360,"FedEx Office in Park Ridge, IL provides a one-stop shop for small businesses printing and shipping expertise and reliable customer service when and where you need it. Services …Learn more about FedEx Office Print & Ship Center, Opens a popupSpecialtiesFedEx Office in Park Ridge, IL provides a one-stop shop for small businesses printing and shipping expertise and reliable customer service when and where you need it. Services include copying and digital printing, direct mail, signs and graphics, Internet access, computer rental, fax services, passport photos, FedEx Express and FedEx Ground shipping.Upload documents with FedEx Office Print Online, and have your flyers, brochures, presentations or signs ready for convenient pick-up or delivery.FedEx Kinko's is now FedEx Office.HistoryEstablished in 1970.FedEx Office (formerly FedEx Kinko's) provides access points to printing and shipping expertise with reliable service when and where you need it. The Dallas-based company has a network of more than 1,900 digitally-connected locations.FedEx Office services include copying and digital printing, professional finishing, document creation, direct mail, signs and graphics, Internet access, computer rental, FedEx Express and FedEx Ground shipping, and more.In addition, the company offers FedEx Office Print Online, an online printing solution for business and personal printing, at home, at the office or on the go.More than 200 locations operate 24 hours a day every day of the week.",,Yes,No,3.5 star rating,15 reviews,http://local.fedex.com/il/park-ridge/office-3620/%3Fcmp%3DLOC-1001545-3-1-971-1110000-US-US-EN-YEXTLISTFXOPRSC,,Mon 7:00 am - 10:00 pm<br>Tue 7:00 am - 10:00 pm<br>Wed 7:00 am - 10:00 pm<br>Thu 7:00 am - 10:00 pm<br>Fri 7:00 am - 10:00 pm<br>Sat 8:00 am - 8:00 pm<br>Sun 10:00 am - 8:00 pm<br>,,,,Yes,,,,,,,,,,,,,,,,,,,,,,,"Printing Services, Shipping Centers, Signmaking, Printing Services, Shipping Centers, Signmaking",42.019233,-87.843640,"https://s3-media3.fl.yelpcdn.com/bphoto/0mZ-TwLw2pY1powYAZ-EHQ/ls.jpg"" srcset=""https://s3-media3.fl.yelpcdn.com/bphoto/0mZ-TwLw2pY1powYAZ-EHQ/258s.jpg 1.03x,https://s3-media3.fl.yelpcdn.com/bphoto/0mZ-TwLw2pY1powYAZ-EHQ/348s.jpg 1.39x,https://s3-media3.fl.yelpcdn.com/bphoto/0mZ-TwLw2pY1powYAZ-EHQ/300s.jpg 1.20x",http://www.yelp.com/biz/fedex-office-print-and-ship-center-park-ridge?osq=Signmaking,,,,,,,,,,
FedEx Office Print & Ship Center,6 W Lake St,Chicago,IL,60601,b/t Wabash Ave & Dearborn St,The Loop,(312) 424-6700,"FedEx Office in Chicago, IL provides a one-stop shop for small businesses printing and shipping expertise and reliable customer service when and where you need it. Services include …Learn more about FedEx Office Print & Ship Center, Opens a popupSpecialtiesFedEx Office in Chicago, IL provides a one-stop shop for small businesses printing and shipping expertise and reliable customer service when and where you need it. Services include copying and digital printing, direct mail, signs and graphics, Internet access, computer rental, fax services, passport photos, FedEx Express and FedEx Ground shipping.Upload documents with FedEx Office Print Online, and have your flyers, brochures, presentations or signs ready for convenient pick-up or delivery.FedEx Kinko's is now FedEx Office.HistoryEstablished in 1970.FedEx Office (formerly FedEx Kinko's) provides access points to printing and shipping expertise with reliable service when and where you need it. The Dallas-based company has a network of more than 1,900 digitally-connected locations.FedEx Office services include copying and digital printing, professional finishing, document creation, direct mail, signs and graphics, Internet access, computer rental, FedEx Express and FedEx Ground shipping, and more.In addition, the company offers FedEx Office Print Online, an online printing solution for business and personal printing, at home, at the office or on the go.More than 200 locations operate 24 hours a day every day of the week.",,Yes,No,3.5 star rating,16 reviews,http://local.fedex.com/il/chicago/office-3628/%3Fcmp%3DLOC-1001545-3-1-971-1110000-US-US-EN-YEXTLISTFXOPRSC,,Mon 7:00 am - 10:00 pm<br>Tue 7:00 am - 10:00 pm<br>Wed 7:00 am - 10:00 pm<br>Thu 7:00 am - 10:00 pm<br>Fri 7:00 am - 10:00 pm<br>Sat Closed<br>Sun Closed<br>,,,,Yes,,,,,,,,,,,,,,,,,,,,,,,"Shipping Centers, Printing Services, Signmaking, Shipping Centers, Printing Services, Signmaking",41.886025,-87.628529,"https://s3-media3.fl.yelpcdn.com/bphoto/Uz3_abYIdedhllta83q7gA/ls.jpg"" srcset=""https://s3-media3.fl.yelpcdn.com/bphoto/Uz3_abYIdedhllta83q7gA/258s.jpg 1.03x,https://s3-media3.fl.yelpcdn.com/bphoto/Uz3_abYIdedhllta83q7gA/348s.jpg 1.39x,https://s3-media3.fl.yelpcdn.com/bphoto/Uz3_abYIdedhllta83q7gA/300s.jpg 1.20x",http://www.yelp.com/biz/fedex-office-print-and-ship-center-chicago-8?osq=Signmaking,,,,,,,,,,
,,,,,,,,,,,,,,,,,,,,,,,,,,,,,,,,,,,,,,,,,,,,,,,,,,,,,,,,,
Rebel Wraps,,Lake in the Hills,IL,60156,,,(844) 567-3235,,,Yes,No,5.0 star rating,3 reviews,http://www.rebelwraps.com/,,Mon 9:00 am - 7:00 pm<br>Tue 9:00 am - 7:00 pm<br>Wed 9:00 am - 7:00 pm<br>Thu 9:00 am - 7:00 pm<br>Fri 9:00 am - 7:00 pm<br>Sat 10:00 am - 2:00 pm<br>Sun Closed<br>,,,,Yes,,,,,,,,,,,,,,,,,,,,,,,"Signmaking, Graphic Design, Vehicle Wraps, Signmaking, Graphic Design, Vehicle Wraps",,,"https://s3-media1.fl.yelpcdn.com/bphoto/kPSnhKbWReACzJlw2760sA/ls.jpg"" srcset=""https://s3-media1.fl.yelpcdn.com/bphoto/kPSnhKbWReACzJlw2760sA/258s.jpg 1.03x,https://s3-media1.fl.yelpcdn.com/bphoto/kPSnhKbWReACzJlw2760sA/348s.jpg 1.39x,https://s3-media1.fl.yelpcdn.com/bphoto/kPSnhKbWReACzJlw2760sA/300s.jpg 1.20x",http://www.yelp.com/biz/rebel-wraps-lake-in-the-hills-2?osq=Signmaking,,,,,,,,,,
FedEx Office Print & Ship Center,608 W Lake St,Chicago,IL,60661,b/t Desplaines St & Jefferson St,"West Loop, Near West Side",(312) 775-0916,"FedEx Office in Chicago, IL provides a one-stop shop for small businesses printing and shipping expertise and reliable customer service when and where you need it. Services include …Learn more about FedEx Office Print & Ship Center, Opens a popupSpecialtiesFedEx Office in Chicago, IL provides a one-stop shop for small businesses printing and shipping expertise and reliable customer service when and where you need it. Services include copying and digital printing, direct mail, signs and graphics, Internet access, computer rental, fax services, passport photos, FedEx Express and FedEx Ground shipping.Upload documents with FedEx Office Print Online, and have your flyers, brochures, presentations or signs ready for convenient pick-up or delivery.FedEx Kinko's is now FedEx Office.HistoryEstablished in 1970.FedEx Office (formerly FedEx Kinko's) provides access points to printing and shipping expertise with reliable service when and where you need it. The Dallas-based company has a network of more than 1,900 digitally-connected locations.FedEx Office services include copying and digital printing, professional finishing, document creation, direct mail, signs and graphics, Internet access, computer rental, FedEx Express and FedEx Ground shipping, and more.In addition, the company offers FedEx Office Print Online, an online printing solution for business and personal printing, at home, at the office or on the go.More than 200 locations operate 24 hours a day every day of the week.",,Yes,No,2.5 star rating,11 reviews,http://local.fedex.com/il/chicago/office-1635/%3Fcmp%3DLOC-1001545-3-1-971-1110000-US-US-EN-YEXTLISTFXOPRSC,,Mon 7:30 am - 9:00 pm<br>Tue 7:30 am - 9:00 pm<br>Wed 7:30 am - 9:00 pm<br>Thu 7:30 am - 9:00 pm<br>Fri 7:30 am - 9:00 pm<br>Sat 8:00 am - 6:00 pm<br>Sun 12:00 pm - 6:00 pm<br>,,,,Yes,,,,,,,,,,,,,,,,,,,,,,,"Printing Services, Shipping Centers, Signmaking, Printing Services, Shipping Centers, Signmaking",41.885863,-87.643240,"https://s3-media2.fl.yelpcdn.com/bphoto/BONbUumnnikH96Nv35VBhg/ls.jpg"" srcset=""https://s3-media2.fl.yelpcdn.com/bphoto/BONbUumnnikH96Nv35VBhg/258s.jpg 1.03x,https://s3-media2.fl.yelpcdn.com/bphoto/BONbUumnnikH96Nv35VBhg/348s.jpg 1.39x,https://s3-media2.fl.yelpcdn.com/bphoto/BONbUumnnikH96Nv35VBhg/300s.jpg 1.20x",http://www.yelp.com/biz/fedex-office-print-and-ship-center-chicago-29?osq=Signmaking,,,,,,,,,,
Verio Graphics,4565 N Elston Ave,Chicago,IL,60630,b/t Kiona Ave & Kennicott Ave,Albany Park,(773) 866-0070,,,Yes,No,2.5 star rating,3 reviews,http://www.verio-graphics.com,,,,,,,,,,,,,,,,,,,,,,,,,,,,,"Vehicle Wraps, Signmaking, Vehicle Wraps, Signmaking",41.964041,-87.733948,"https://s3-media2.fl.yelpcdn.com/bphoto/PcJN4Vg0rcM3MfVNoDiV_A/ls.jpg"" srcset=""https://s3-media2.fl.yelpcdn.com/bphoto/PcJN4Vg0rcM3MfVNoDiV_A/258s.jpg 1.03x,https://s3-media2.fl.yelpcdn.com/bphoto/PcJN4Vg0rcM3MfVNoDiV_A/348s.jpg 1.39x,https://s3-media2.fl.yelpcdn.com/bphoto/PcJN4Vg0rcM3MfVNoDiV_A/300s.jpg 1.20x",http://www.yelp.com/biz/verio-graphics-chicago?osq=Signmaking,,,,,,,,,,
The Sign Centre,,Skokie,IL,60076,,,(847) 595-7300,,,Yes,No,4.0 star rating,1 review,http://www.thesigncentrechicago.com,,Mon 8:00 am - 5:00 pm<br>Tue 8:00 am - 5:00 pm<br>Wed 8:00 am - 5:00 pm<br>Thu 8:00 am - 5:00 pm<br>Fri 8:00 am - 5:00 pm<br>Sat Closed<br>Sun Closed<br>,,,,,,,,,,,,,,,,,,,,,,,,,,,"Graphic Design, Signmaking, Graphic Design, Signmaking",,,,http://www.yelp.com/biz/the-sign-centre-skokie?osq=Signmaking,,,,,,,,,,
FedEx Office Print & Ship Center,320 N Dearborn St,Chicago,IL,60654,,Near North Side,(312) 836-0983,,,Yes,No,3.0 star rating,2 reviews,http://local.fedex.com/il/chicago/office-5651/%3Fcmp%3DLOC-1001545-3-1-971-1110000-US-US-EN-YEXTLISTFXOPRSC,,Mon 7:30 am - 5:30 pm<br>Tue 7:30 am - 5:30 pm<br>Wed 7:30 am - 5:30 pm<br>Thu 7:30 am - 5:30 pm<br>Fri 7:30 am - 5:30 pm<br>Sat Closed<br>Sun Closed<br>,,,,,,,,,,,,,,,,,,,,,,,,,,,"Printing Services, Shipping Centers, Signmaking, Printing Services, Shipping Centers, Signmaking",41.888382,-87.629897,"https://s3-media3.fl.yelpcdn.com/bphoto/Q6yIUOEu9BtR8F1ofm_K_A/ls.jpg"" srcset=""https://s3-media3.fl.yelpcdn.com/bphoto/Q6yIUOEu9BtR8F1ofm_K_A/258s.jpg 1.03x,https://s3-media3.fl.yelpcdn.com/bphoto/Q6yIUOEu9BtR8F1ofm_K_A/348s.jpg 1.39x,https://s3-media3.fl.yelpcdn.com/bphoto/Q6yIUOEu9BtR8F1ofm_K_A/300s.jpg 1.20x",http://www.yelp.com/biz/fedex-office-conventions-and-universities-chicago-2?osq=Signmaking,,,,,,,,,,
"Sir Speedy Print, Signs, Marketing",250 E Saint Charles Rd,Villa Park,IL,60181,,,(630) 279-0150,,Bill S.,Yes,No,5.0 star rating,8 reviews,http://sirspeedy.com/villapark,,Mon 8:00 am - 5:00 pm<br>Tue 8:00 am - 5:00 pm<br>Wed 8:00 am - 5:00 pm<br>Thu 8:00 am - 5:00 pm<br>Fri 8:00 am - 5:00 pm<br>Sat Closed<br>Sun Closed<br>,,,,Yes,,,,,,,,,,,,,,,,,,,,,,,"Printing Services, Marketing, Signmaking, Printing Services, Marketing, Signmaking",41.890260,-87.972839,"https://s3-media3.fl.yelpcdn.com/bphoto/HjacpwBZAnJ89KoAeM2oAA/ls.jpg"" srcset=""https://s3-media3.fl.yelpcdn.com/bphoto/HjacpwBZAnJ89KoAeM2oAA/258s.jpg 1.03x,https://s3-media3.fl.yelpcdn.com/bphoto/HjacpwBZAnJ89KoAeM2oAA/348s.jpg 1.39x,https://s3-media3.fl.yelpcdn.com/bphoto/HjacpwBZAnJ89KoAeM2oAA/300s.jpg 1.20x",http://www.yelp.com/biz/sir-speedy-print-signs-marketing-villa-park?osq=Signmaking,,,,,,,,,,
Reel E-Z Display,,Chicago,IL,60613,,Uptown,(312) 235-2597,,,No,No,,,http://www.reelezdisplay.com,,,,,,,,,,,,,,,,,,,,,,,,,,,,,"Signmaking, Printing Services, Signmaking, Printing Services",,,,http://www.yelp.com/biz/reel-e-z-display-chicago?osq=Signmaking,,,,,,,,,,
FedEx Office Print & Ship Center,1242 S Canal St,Chicago,IL,60607,at Roosevelt Rd,,(312) 455-0920,"FedEx Office in Chicago, IL provides a one-stop shop for small businesses printing and shipping expertise and reliable customer service when and where you need it. Services include …Learn more about FedEx Office Print & Ship Center, Opens a popupSpecialtiesFedEx Office in Chicago, IL provides a one-stop shop for small businesses printing and shipping expertise and reliable customer service when and where you need it. Services include copying and digital printing, direct mail, signs and graphics, Internet access, computer rental, fax services, passport photos, FedEx Express and FedEx Ground shipping.Upload documents with FedEx Office Print Online, and have your flyers, brochures, presentations or signs ready for convenient pick-up or delivery.FedEx Kinko's is now FedEx Office.HistoryEstablished in 1970.FedEx Office (formerly FedEx Kinko's) provides access points to printing and shipping expertise with reliable service when and where you need it. The Dallas-based company has a network of more than 1,900 digitally-connected locations.FedEx Office services include copying and digital printing, professional finishing, document creation, direct mail, signs and graphics, Internet access, computer rental, FedEx Express and FedEx Ground shipping, and more.In addition, the company offers FedEx Office Print Online, an online printing solution for business and personal printing, at home, at the office or on the go.More than 200 locations operate 24 hours a day every day of the week.",,Yes,No,2.5 star rating,46 reviews,http://local.fedex.com/il/chicago/office-0321/%3Fcmp%3DLOC-1001545-3-1-971-1110000-US-US-EN-YEXTLISTFXOPRSC,,Mon Open 24 hours<br>Tue Open 24 hours<br>Wed Open 24 hours<br>Thu Open 24 hours<br>Fri Open 24 hours<br>Sat Open 24 hours<br>Sun Open 24 hours<br>,,,,Yes,,,,,,,,,,,,,,,,,,,,,,,"Printing Services, Shipping Centers, Signmaking, Printing Services, Shipping Centers, Signmaking",41.865993,-87.640357,"https://s3-media4.fl.yelpcdn.com/bphoto/K3ghnUFLLVe218ClxRBRlg/ls.jpg"" srcset=""https://s3-media4.fl.yelpcdn.com/bphoto/K3ghnUFLLVe218ClxRBRlg/258s.jpg 1.03x,https://s3-media4.fl.yelpcdn.com/bphoto/K3ghnUFLLVe218ClxRBRlg/348s.jpg 1.39x,https://s3-media4.fl.yelpcdn.com/bphoto/K3ghnUFLLVe218ClxRBRlg/300s.jpg 1.20x",http://www.yelp.com/biz/fedex-office-print-and-ship-center-chicago-22?osq=Signmaking,,,,,,,,,,
Post Ink,1634 E 53rd St,Chicago,IL,60615,b/t Cornell Ave & Hyde Park Blvd,Hyde Park,(773) 952-4626,,Marc E.,Yes,No,1.5 star rating,3 reviews,,,Mon 10:00 am - 7:00 pm<br>Tue 10:00 am - 7:00 pm<br>Wed 10:00 am - 7:00 pm<br>Thu 10:00 am - 7:00 pm<br>Fri 10:00 am - 7:00 pm<br>Sat Closed<br>Sun Closed<br>,,,,,,,,,,,,,,,,,,,,,,,,,,,"Web Design, Signmaking, Shipping Centers, Web Design, Signmaking, Shipping Centers",41.799754,-87.585186,"https://s3-media2.fl.yelpcdn.com/bphoto/i0xA6OXDJZVxV39JOoZcIQ/ls.jpg"" srcset=""https://s3-media2.fl.yelpcdn.com/bphoto/i0xA6OXDJZVxV39JOoZcIQ/258s.jpg 1.03x,https://s3-media2.fl.yelpcdn.com/bphoto/i0xA6OXDJZVxV39JOoZcIQ/348s.jpg 1.39x,https://s3-media2.fl.yelpcdn.com/bphoto/i0xA6OXDJZVxV39JOoZcIQ/300s.jpg 1.20x",http://www.yelp.com/biz/post-ink-chicago?osq=Signmaking,,,,,,,,,,
Signarama,1701 Quincy Ave Ste 24,Naperville,IL,60540,,,(630) 527-0500,,,Yes,No,5.0 star rating,3 reviews,http://www.signarama.com/il-naperville,,Mon 8:00 am - 5:00 pm<br>Tue 8:00 am - 5:00 pm<br>Wed 8:00 am - 5:00 pm<br>Thu 8:00 am - 5:00 pm<br>Fri 8:00 am - 4:00 pm<br>Sat Closed<br>Sun Closed<br>,,,,Yes,,,,,,,,,,,,,,,,,,,,,,,"Graphic Design, Signmaking, Vehicle Wraps, Graphic Design, Signmaking, Vehicle Wraps",,,"https://s3-media3.fl.yelpcdn.com/bphoto/S3crrbgM_yDWAmq0URSfgw/ls.jpg"" srcset=""https://s3-media3.fl.yelpcdn.com/bphoto/S3crrbgM_yDWAmq0URSfgw/258s.jpg 1.03x,https://s3-media3.fl.yelpcdn.com/bphoto/S3crrbgM_yDWAmq0URSfgw/348s.jpg 1.39x,https://s3-media3.fl.yelpcdn.com/bphoto/S3crrbgM_yDWAmq0URSfgw/300s.jpg 1.20x",http://www.yelp.com/biz/signarama-naperville?osq=Signmaking,,,,,,,,,,
Comet Neon,1120 N Ridge Ave,Lombard,IL,60148,,,(630) 656-1085,,,Yes,No,,,http://cometneon.com,,Mon 8:00 am - 4:00 pm<br>Tue 8:00 am - 4:00 pm<br>Wed 8:00 am - 4:00 pm<br>Thu 8:00 am - 4:00 pm<br>Fri 8:00 am - 4:00 pm<br>Sat Closed<br>Sun Closed<br>,,,,Yes,,,,,,,,,,,,,,,,,,,,,,,"Signmaking, Awnings, Signmaking, Awnings",,,"https://s3-media2.fl.yelpcdn.com/bphoto/hZvxadzMGl3zveJDapYVTQ/ls.jpg"" srcset=""https://s3-media2.fl.yelpcdn.com/bphoto/hZvxadzMGl3zveJDapYVTQ/258s.jpg 1.03x,https://s3-media2.fl.yelpcdn.com/bphoto/hZvxadzMGl3zveJDapYVTQ/348s.jpg 1.39x,https://s3-media2.fl.yelpcdn.com/bphoto/hZvxadzMGl3zveJDapYVTQ/300s.jpg 1.20x",http://www.yelp.com/biz/comet-neon-lombard-5?osq=Signmaking,,,,,,,,,,
FedEx Office Print & Ship Center,3001 N Clark St,Chicago,IL,60657,b/t Barry Ave & Wellington Ave,Lakeview,(773) 528-0500,"FedEx Office in Chicago, IL provides a one-stop shop for small businesses printing and shipping expertise and reliable customer service when and where you need it. Services include …Learn more about FedEx Office Print & Ship Center, Opens a popupSpecialtiesFedEx Office in Chicago, IL provides a one-stop shop for small businesses printing and shipping expertise and reliable customer service when and where you need it. Services include copying and digital printing, direct mail, signs and graphics, Internet access, computer rental, fax services, passport photos, FedEx Express and FedEx Ground shipping.Upload documents with FedEx Office Print Online, and have your flyers, brochures, presentations or signs ready for convenient pick-up or delivery.FedEx Kinko's is now FedEx Office.HistoryEstablished in 1970.FedEx Office (formerly FedEx Kinko's) provides access points to printing and shipping expertise with reliable service when and where you need it. The Dallas-based company has a network of more than 1,900 digitally-connected locations.FedEx Office services include copying and digital printing, professional finishing, document creation, direct mail, signs and graphics, Internet access, computer rental, FedEx Express and FedEx Ground shipping, and more.In addition, the company offers FedEx Office Print Online, an online printing solution for business and personal printing, at home, at the office or on the go.More than 200 locations operate 24 hours a day every day of the week.",,Yes,No,2.5 star rating,90 reviews,http://local.fedex.com/il/chicago/office-3612/%3Fcmp%3DLOC-1001545-3-1-971-1110000-US-US-EN-YEXTLISTFXOPRSC,,Mon Open 24 hours<br>Tue Open 24 hours<br>Wed Open 24 hours<br>Thu Open 24 hours<br>Fri Open 24 hours<br>Sat Open 24 hours<br>Sun Open 24 hours<br>,,,,Yes,,,,,,,,,,,,,,,,,,,,,,,"Shipping Centers, Printing Services, Signmaking, Shipping Centers, Printing Services, Signmaking",41.936628,-87.647551,"https://s3-media4.fl.yelpcdn.com/bphoto/tGntxs1wgwl2IVcwgfhm0A/ls.jpg"" srcset=""https://s3-media4.fl.yelpcdn.com/bphoto/tGntxs1wgwl2IVcwgfhm0A/258s.jpg 1.03x,https://s3-media4.fl.yelpcdn.com/bphoto/tGntxs1wgwl2IVcwgfhm0A/348s.jpg 1.39x,https://s3-media4.fl.yelpcdn.com/bphoto/tGntxs1wgwl2IVcwgfhm0A/300s.jpg 1.20x",http://www.yelp.com/biz/fedex-office-print-and-ship-center-chicago-14?osq=Signmaking,,,,,,,,,,
