Name,Street Address,City,State,Zip Code,Cross Streets,Neighborhood,Phone,Description,Business Owner,Merchant Verified,Paid Listing,Rating,Reviews,Website,Price Range,Hours,Takes Reservations,Delivery,Take Out,Accepts Credit Cards,Good For,Parking,Wheelchair Accessable,Good For Kids,Good For Groups,Attire,Ambience,Noise Level,Music,Dancing,Serves Alcohol,Happy Hour,Best Nights,Coat Check,Smoking Allowed,Outdoor Seating,Wifi,Has Tv,Allows Dogs,Waiter Service,Caters,By Appointment Only,Category,Lat,Long,Image URL,Listing URL,Deal,Deal Description,Deal Orignal Price,Deal Discount,Deal Savings,Deal Link,Email from Web,Facebook URL,Twitter URL,Google Plus URL
FASTSIGNS,118 N Halsted St Ste 1,Chicago,IL,60661,b/t Randolph St & Court Pl,"West Loop, Near West Side",(312) 344-1765,,,Yes,No,5.0 star rating,8 reviews,http://www.fastsigns.com/2013,,Mon 9:00 am - 5:30 pm<br>Tue 9:00 am - 5:30 pm<br>Wed 9:00 am - 5:30 pm<br>Thu 9:00 am - 5:30 pm<br>Fri 9:00 am - 5:30 pm<br>Sat Closed<br>Sun Closed<br>,,,,Yes,,,,,,,,,,,,,,,,,,,,,,,"Signmaking, Printing Services, Signmaking, Printing Services",41.883714,-87.647781,"https://s3-media3.fl.yelpcdn.com/bphoto/kfLqYyhvfeBLeYQiTmyxSg/ls.jpg"" srcset=""https://s3-media3.fl.yelpcdn.com/bphoto/kfLqYyhvfeBLeYQiTmyxSg/258s.jpg 1.03x,https://s3-media3.fl.yelpcdn.com/bphoto/kfLqYyhvfeBLeYQiTmyxSg/348s.jpg 1.39x,https://s3-media3.fl.yelpcdn.com/bphoto/kfLqYyhvfeBLeYQiTmyxSg/300s.jpg 1.20x",http://www.yelp.com/biz/fastsigns-chicago-6?osq=Signmaking,,,,,,,,,,
YESCO Chicago Sign & Lighting Repair,2311 W Belmont Ave,Chicago,IL,60618,b/t Clybourn Ave & Oakley Ave,Roscoe Village,(630) 237-4399,,,Yes,No,,,http://www.yesco.com/chicago/,,Mon 8:00 am - 5:00 pm<br>Tue 8:00 am - 5:00 pm<br>Wed 8:00 am - 5:00 pm<br>Thu 8:00 am - 5:00 pm<br>Fri 8:00 am - 5:00 pm<br>Sat Closed<br>Sun Closed<br>,,,,Yes,,,,,,,,,,,,,,,,,,,,,,No,"Lighting Fixtures & Equipment, Signmaking, Lighting Fixtures & Equipment, Signmaking",,,"https://s3-media2.fl.yelpcdn.com/bphoto/0bF6iSAjVps4L9r-9LfNlg/ls.jpg"" srcset=""https://s3-media2.fl.yelpcdn.com/bphoto/0bF6iSAjVps4L9r-9LfNlg/258s.jpg 1.03x,https://s3-media2.fl.yelpcdn.com/bphoto/0bF6iSAjVps4L9r-9LfNlg/348s.jpg 1.39x,https://s3-media2.fl.yelpcdn.com/bphoto/0bF6iSAjVps4L9r-9LfNlg/300s.jpg 1.20x",http://www.yelp.com/biz/yesco-chicago-sign-and-lighting-repair-chicago?osq=Signmaking,,,,,,,cmenna@yesco.com,,,
TFA Signs,5500 N Kedzie Ave,Chicago,IL,60625,b/t Jersey Ave & Bryn Mawr Ave,North Park,(773) 267-6007,"Electric Signs, Custom Signs, Printing, Banners, Installation, Permits, Survey, Channel Letters, Awnings, CanopiesLearn more about TFA Signs, Opens a popupSpecialtiesElectric Signs, Custom Signs, Printing, Banners, Installation, Permits, Survey, Channel Letters, Awnings, CanopiesHistoryEstablished in 1995.TFA Signs Chicago is a family owned and operated neon sign business that has offered Sign Fabrication, Sign Maintenance, Repairs, Sign Installation and Custom Displays to customers in the Chicago Metro area for over 15 years.As family business owners with many years of experience in the business world, we recognize the importance of service to our customers. In addition to building competitivelypriced, high-quality signs, we guarantee customer satisfaction and on-time delivery. We are known as the most professional sign company in the Midwest.We specialize in custom signs and neon displays to accommodate your business needs..TFA Signs Chicago can help design you the best impression possible. TFA signs Chicago uses brilliant, fade-resistant inks, along with premium materials, and state-of-the-art technologies to create the kind of image you'll be proud to display.",,Yes,No,4.5 star rating,26 reviews,http://www.tfasigns.com,,Mon 9:00 am - 5:00 pm<br>Tue 9:00 am - 5:00 pm<br>Wed 9:00 am - 5:00 pm<br>Thu 9:00 am - 5:00 pm<br>Fri 9:00 am - 5:00 pm<br>Sat Closed<br>Sun Closed<br>,,,,Yes,,,,,,,,,,,,,,,,,,,,,,,"Printing Services, Signmaking, Printing Services, Signmaking",41.981681,-87.707655,"https://s3-media3.fl.yelpcdn.com/bphoto/xWUHaQEblLWL-t6PKMct8A/ls.jpg"" srcset=""https://s3-media3.fl.yelpcdn.com/bphoto/xWUHaQEblLWL-t6PKMct8A/258s.jpg 1.03x,https://s3-media3.fl.yelpcdn.com/bphoto/xWUHaQEblLWL-t6PKMct8A/348s.jpg 1.39x,https://s3-media3.fl.yelpcdn.com/bphoto/xWUHaQEblLWL-t6PKMct8A/300s.jpg 1.20x",http://www.yelp.com/biz/tfa-signs-chicago-2?osq=Signmaking,$95 for $125 Deal at TFA Signs,You get a voucher redeemable for $125 at TFA Signs.,$125,24%,$30,https://www.yelp.com/checkout/deal/UzHCjGBBfFPhBU1jQ6YbAA?biz_id=4siYdXAn5uEkKNOxzOYk8Q&return_url=%2Fbiz%2Ftfa-signs-chicago-2,,,,
InoPrints,700 N Green St Ste 503,Chicago,IL,60642,,"River West, Noble Square, West Town",(312) 994-2351,"InoPrints was created in 2007 to provide an easy and affordable way for businesses, musicians, and artists to print their promotional products. We are passionate about helping …Learn more about InoPrints, Opens a popupSpecialtiesInoPrints was created in 2007 to provide an easy and affordable way for businesses, musicians, and artists to print their promotional products. We are passionate about helping companies & artists market their ideas and products to their customers and fans.We specialize in business card printing, postcard / club flyer printing, brochure printing, cd printing & duplication, sticker printing, banner printing, CD Insert printing, graphic design, and more.HistoryEstablished in 2007.A group of musicians and artists in Chicago were tired of printing out of state. Printing out of state meant expensive shipping costs and long turnaround time.This group, who worked tightly with the artistic community, decided to bring a fast and cost effective way to Chicago. This helps people get their music out to their fans within a few days. This also helps businesses reach their prospects/customers much quicker.InoPrints is dedicated to helping businesses, musicians, and artists grow by maintaining integrity, quality, and long business/family relationships.Meet the Business Owner",Jovim V.,Yes,No,5.0 star rating,77 reviews,http://www.inoprints.com,,Mon 10:00 am - 5:00 pm<br>Tue 10:00 am - 5:00 pm<br>Wed 10:00 am - 5:00 pm<br>Thu 10:00 am - 5:00 pm<br>Fri 10:00 am - 5:00 pm<br>Sat Closed<br>Sun Closed<br>,,,,Yes,,,,,,,,,,,,,,,,,,,,,,,"Printing Services, Signmaking, Screen Printing/T-Shirt Printing, Printing Services, Signmaking, Screen Printing/T-Shirt Printing",41.895288,-87.649110,"https://s3-media2.fl.yelpcdn.com/bphoto/pVNVEF9rbKcvOSsDUIcxMQ/ls.jpg"" srcset=""https://s3-media2.fl.yelpcdn.com/bphoto/pVNVEF9rbKcvOSsDUIcxMQ/258s.jpg 1.03x,https://s3-media2.fl.yelpcdn.com/bphoto/pVNVEF9rbKcvOSsDUIcxMQ/348s.jpg 1.39x,https://s3-media2.fl.yelpcdn.com/bphoto/pVNVEF9rbKcvOSsDUIcxMQ/300s.jpg 1.20x",http://www.yelp.com/biz/inoprints-chicago?osq=Signmaking,,,,,,,,,,
Sign Zone,3211 W Irving Park Rd,Chicago,IL,60618,b/t Kedzie Ave & Sawyer Ave,Irving Park,(312) 248-5404,,,Yes,No,5.0 star rating,1 review,http://signzoneusa.com,,Mon 10:00 am - 5:00 pm<br>Tue 10:00 am - 5:00 pm<br>Wed 10:00 am - 5:00 pm<br>Thu 10:00 am - 5:00 pm<br>Fri 10:00 am - 5:00 pm<br>Sat Closed<br>Sun Closed<br>,,,,,,,,,,,,,,,,,,,,,,,,,,,"Signmaking, Signmaking",41.953678,-87.708508,"https://s3-media3.fl.yelpcdn.com/bphoto/A385qtAJ69v-GCBEpHC1Dg/ls.jpg"" srcset=""https://s3-media3.fl.yelpcdn.com/bphoto/A385qtAJ69v-GCBEpHC1Dg/258s.jpg 1.03x,https://s3-media3.fl.yelpcdn.com/bphoto/A385qtAJ69v-GCBEpHC1Dg/348s.jpg 1.39x,https://s3-media3.fl.yelpcdn.com/bphoto/A385qtAJ69v-GCBEpHC1Dg/300s.jpg 1.20x",http://www.yelp.com/biz/sign-zone-chicago-2?osq=Signmaking,,,,,,,,,,
Signs House,3415 N Pulaski Rd,Chicago,IL,60641,b/t Roscoe St & Newport Ave,Avondale,(630) 888-9381,"We are producers/distributors of all kinds of signs and sign-related products and marketing materials.Our goal is to understand and meet the needs of our customer and make sure …Learn more about Signs House, Opens a popupSpecialtiesWe are producers/distributors of all kinds of signs and sign-related products and marketing materials.Our goal is to understand and meet the needs of our customer and make sure they get the most effective way to deliver their message, Channel letters, 3D Signs, Light boxes, LED Signs, Vinyl Graphics, Banners, Graphic Design, Store Window Graphics, Vehicle wraps, Events Materials, Marketing Materials and Trade Show Materials,in affordable,yet professional and durable work.HistoryEstablished in 2009.We are a Chicago well established sign and printing company, we handle all your advertising needs from a simple window poster to a high end store or company sign and everything in between, we also make great trade shows material, call today for free estimate, its always free!!Meet the Manager",,Yes,No,4.5 star rating,14 reviews,http://www.signshouse.com/,,Mon Open 24 hours<br>Tue Open 24 hours<br>Wed Open 24 hours<br>Thu Open 24 hours<br>Fri Open 24 hours<br>Sat Open 24 hours<br>Sun Open 24 hours<br>,,,,,,,,,,,,,,,,,,,,,,,,,,,"Signmaking, Signmaking",41.943288,-87.726956,"https://s3-media2.fl.yelpcdn.com/bphoto/0m7bLNrBZnfgrWvQFGe5yQ/ls.jpg"" srcset=""https://s3-media2.fl.yelpcdn.com/bphoto/0m7bLNrBZnfgrWvQFGe5yQ/258s.jpg 1.03x,https://s3-media2.fl.yelpcdn.com/bphoto/0m7bLNrBZnfgrWvQFGe5yQ/348s.jpg 1.39x,https://s3-media2.fl.yelpcdn.com/bphoto/0m7bLNrBZnfgrWvQFGe5yQ/300s.jpg 1.20x",http://www.yelp.com/biz/signs-house-chicago?osq=Signmaking,,,,,,,,,,
Signarama,2525 N Elston Ave,Chicago,IL,60647,at Leavitt St,Bucktown,(773) 395-2525,,,Yes,No,5.0 star rating,2 reviews,,,Mon 9:30 am - 6:00 pm<br>Tue 9:30 am - 6:00 pm<br>Wed 9:30 am - 6:00 pm<br>Thu 9:30 am - 6:00 pm<br>Fri 9:30 am - 6:00 pm<br>Sat Closed<br>Sun Closed<br>,,,,Yes,,,,,,,,,,,,,,,,,,,,,,,"Printing Services, Graphic Design, Signmaking, Printing Services, Graphic Design, Signmaking",41.927800,-87.680994,"https://s3-media2.fl.yelpcdn.com/bphoto/0nd3ouFGQxvDS3TE-SO9YA/ls.jpg"" srcset=""https://s3-media2.fl.yelpcdn.com/bphoto/0nd3ouFGQxvDS3TE-SO9YA/258s.jpg 1.03x,https://s3-media2.fl.yelpcdn.com/bphoto/0nd3ouFGQxvDS3TE-SO9YA/348s.jpg 1.39x,https://s3-media2.fl.yelpcdn.com/bphoto/0nd3ouFGQxvDS3TE-SO9YA/300s.jpg 1.20x",http://www.yelp.com/biz/signarama-chicago?osq=Signmaking,,,,,,,,,,
GALEXY DESIGN,1615 N Drake Ave,Chicago,IL,60647,b/t Wabansia Ave & North Ave,Humboldt Park,(815) 274-9638,,Davis M.,Yes,No,5.0 star rating,6 reviews,http://www.galexydesign.com,,Mon 6:00 pm - 11:00 pm<br>Tue 6:00 pm - 11:00 pm<br>Wed 6:00 pm - 11:00 pm<br>Thu 6:00 pm - 11:00 pm<br>Fri 6:00 pm - 11:00 pm<br>Sat 10:00 am - 5:00 pm<br>Sun 10:00 am - 5:00 pm<br>,,,,,,,,,,,,,,,,,,,,,,,,,,,"Signmaking, Signmaking",41.910329,-87.714914,"https://s3-media2.fl.yelpcdn.com/bphoto/LbynpTV8lGQy3QeHNqdaVg/ls.jpg"" srcset=""https://s3-media2.fl.yelpcdn.com/bphoto/LbynpTV8lGQy3QeHNqdaVg/258s.jpg 1.03x,https://s3-media2.fl.yelpcdn.com/bphoto/LbynpTV8lGQy3QeHNqdaVg/348s.jpg 1.39x,https://s3-media2.fl.yelpcdn.com/bphoto/LbynpTV8lGQy3QeHNqdaVg/300s.jpg 1.20x",http://www.yelp.com/biz/galexy-design-chicago?osq=Signmaking,,,,,,,,,,
Rendex Design,401 North Michigan Ave,Chicago,IL,60611,at North Water St,,(847) 306-3737,,,Yes,No,5.0 star rating,1 review,http://rendexdesign.com,,Mon 9:00 am - 5:00 pm<br>Tue 9:00 am - 5:00 pm<br>Wed 9:00 am - 5:00 pm<br>Thu 9:00 am - 5:00 pm<br>Fri 9:00 am - 2:00 pm<br>Sat Closed<br>Sun Closed<br>,,,,Yes,,,,,,,,,,,,,,,,,,,,,,,"Graphic Design, Signmaking, Printing Services, Graphic Design, Signmaking, Printing Services",41.912497,-87.809601,"https://s3-media4.fl.yelpcdn.com/bphoto/Nmqt6zriOhlQHzoyga6Z4w/ls.jpg"" srcset=""https://s3-media4.fl.yelpcdn.com/bphoto/Nmqt6zriOhlQHzoyga6Z4w/258s.jpg 1.03x,https://s3-media4.fl.yelpcdn.com/bphoto/Nmqt6zriOhlQHzoyga6Z4w/348s.jpg 1.39x,https://s3-media4.fl.yelpcdn.com/bphoto/Nmqt6zriOhlQHzoyga6Z4w/300s.jpg 1.20x",http://www.yelp.com/biz/rendex-design-chicago-2?osq=Signmaking,,,,,,,,,,
Signarama,1513 S State St,Chicago,IL,60605,at 15th St,Near Southside,(312) 548-6073,,,Yes,No,4.5 star rating,8 reviews,https://www.signarama.com/il-chicago-downtown,,Mon 9:00 am - 6:00 pm<br>Tue 9:00 am - 6:00 pm<br>Wed 9:00 am - 6:00 pm<br>Thu 9:00 am - 6:00 pm<br>Fri 9:00 am - 6:00 pm<br>Sat Closed<br>Sun Closed<br>,,,,Yes,,,,,,,,,,,,,,,,,,,,,,,"Signmaking, Printing Services, Graphic Design, Signmaking, Printing Services, Graphic Design",41.861537,-87.627114,"https://s3-media1.fl.yelpcdn.com/bphoto/RRN7ifPLZ-4XlAyGd09TKQ/ls.jpg"" srcset=""https://s3-media1.fl.yelpcdn.com/bphoto/RRN7ifPLZ-4XlAyGd09TKQ/258s.jpg 1.03x,https://s3-media1.fl.yelpcdn.com/bphoto/RRN7ifPLZ-4XlAyGd09TKQ/348s.jpg 1.39x,https://s3-media1.fl.yelpcdn.com/bphoto/RRN7ifPLZ-4XlAyGd09TKQ/300s.jpg 1.20x",http://www.yelp.com/biz/signarama-chicago-3?osq=Signmaking,,,,,,,Loopsigns@yahoo.com,,,
"Right Way Signs, LLC",2333 N Seeley Ave,Chicago,IL,60647,at Fullerton Ave,Bucktown,(773) 930-4361,,Ches P.,Yes,No,4.5 star rating,7 reviews,http://www.RightWaySigns.com,,Mon 9:00 am - 5:00 pm<br>Tue 9:00 am - 5:00 pm<br>Wed 9:00 am - 5:00 pm<br>Thu 9:00 am - 5:00 pm<br>Fri 9:00 am - 5:00 pm<br>Sat Closed<br>Sun Closed<br>,,,,,,,,,,,,,,,,,,,,,,,,,,,"Signmaking, Bakeries, Signmaking",41.923860,-87.679112,"https://s3-media1.fl.yelpcdn.com/bphoto/POSHQctP7iHBOhTVvY9oBw/ls.jpg"" srcset=""https://s3-media1.fl.yelpcdn.com/bphoto/POSHQctP7iHBOhTVvY9oBw/258s.jpg 1.03x,https://s3-media1.fl.yelpcdn.com/bphoto/POSHQctP7iHBOhTVvY9oBw/348s.jpg 1.39x,https://s3-media1.fl.yelpcdn.com/bphoto/POSHQctP7iHBOhTVvY9oBw/300s.jpg 1.20x",http://www.yelp.com/biz/right-way-signs-llc-chicago?osq=Signmaking,,,,,,,sales@rightwaysigns.com,,,
Dimension Craft Inc,2600 W 50th St,Chicago,IL,60632,b/t Rockwell St & Talman Ave,Gage Park,(773) 925-6500,,,Yes,No,5.0 star rating,1 review,http://www.dimensioncraftinc.com,,,,,,,,,,,,,,,,,,,,,,,,,,,,,"Signmaking, Graphic Design, Signmaking, Graphic Design",41.803292,-87.689842,"https://s3-media4.fl.yelpcdn.com/bphoto/xGVNeGDVY6psjmOQrhRezw/ls.jpg"" srcset=""https://s3-media4.fl.yelpcdn.com/bphoto/xGVNeGDVY6psjmOQrhRezw/258s.jpg 1.03x,https://s3-media4.fl.yelpcdn.com/bphoto/xGVNeGDVY6psjmOQrhRezw/348s.jpg 1.39x,https://s3-media4.fl.yelpcdn.com/bphoto/xGVNeGDVY6psjmOQrhRezw/300s.jpg 1.20x",http://www.yelp.com/biz/dimension-craft-inc-chicago?osq=Signmaking,,,,,,,,,,
SirSpeedy - Chicago,4209 N Milwaukee Ave,Chicago,IL,60641,b/t Hutchinson St & Berteau Ave,Portage Park,(773) 777-2880,,,Yes,No,4.5 star rating,6 reviews,http://www.sirspeedy.com/sixcorners,,Mon 9:00 am - 5:00 pm<br>Tue 9:00 am - 5:00 pm<br>Wed 9:00 am - 5:00 pm<br>Thu 9:00 am - 5:00 pm<br>Fri 9:00 am - 5:00 pm<br>Sat Closed<br>Sun Closed<br>,,,,Yes,,,,,,,,,,,,,,,,,,,,,,,"Printing Services, Marketing, Signmaking, Cards & Stationery, Gift Shops, Printing Services, Marketing, Signmaking",41.957343,-87.751347,"https://s3-media2.fl.yelpcdn.com/bphoto/iwVVX0iGIByHRimgMV1oKA/ls.jpg"" srcset=""https://s3-media2.fl.yelpcdn.com/bphoto/iwVVX0iGIByHRimgMV1oKA/258s.jpg 1.03x,https://s3-media2.fl.yelpcdn.com/bphoto/iwVVX0iGIByHRimgMV1oKA/348s.jpg 1.39x,https://s3-media2.fl.yelpcdn.com/bphoto/iwVVX0iGIByHRimgMV1oKA/300s.jpg 1.20x",http://www.yelp.com/biz/sir-speedy-chicago-chicago?osq=Signmaking,,,,,,,,,,
Mid-West Sign Supply Company,5521 N Lynch Ave,Chicago,IL,60630,b/t Elston Ave & Leavenworth Ave,Jefferson Park,(773) 588-0523,,,Yes,No,4.5 star rating,2 reviews,http://www.midwestsignsupplyco.com/,,Mon 7:30 am - 4:30 pm<br>Tue 7:30 am - 4:30 pm<br>Wed 7:30 am - 4:30 pm<br>Thu 7:30 am - 4:30 pm<br>Fri 7:30 am - 4:30 pm<br>Sat Closed<br>Sun Closed<br>,,,,,,,,,,,,,,,,,,,,,,,,,,,"Signmaking, Signmaking",41.981402,-87.760295,,http://www.yelp.com/biz/mid-west-sign-supply-company-chicago?osq=Signmaking,,,,,,,,,,
Evanston Quick Signs,7526 N Paulina St,Chicago,IL,60626,,Rogers Park,(312) 520-7468,,,Yes,No,5.0 star rating,3 reviews,http://www.evanstonquicksigns.com,,Mon 10:00 am - 7:00 pm<br>Tue 10:00 am - 7:00 pm<br>Wed 10:00 am - 7:00 pm<br>Thu 10:00 am - 7:00 pm<br>Fri 10:00 am - 7:00 pm<br>Sat 10:00 am - 7:00 pm<br>Sun 10:00 am - 7:00 pm<br>,,,,Yes,,,,,,,,,,,,,,,,,,,,,,,"Screen Printing/T-Shirt Printing, Signmaking, Marketing, Screen Printing/T-Shirt Printing, Signmaking, Marketing",42.019279,-87.673865,"https://s3-media2.fl.yelpcdn.com/bphoto/B2gZmM47CieqcQwPaum1zQ/ls.jpg"" srcset=""https://s3-media2.fl.yelpcdn.com/bphoto/B2gZmM47CieqcQwPaum1zQ/258s.jpg 1.03x,https://s3-media2.fl.yelpcdn.com/bphoto/B2gZmM47CieqcQwPaum1zQ/348s.jpg 1.39x,https://s3-media2.fl.yelpcdn.com/bphoto/B2gZmM47CieqcQwPaum1zQ/300s.jpg 1.20x",http://www.yelp.com/biz/evanston-quick-signs-chicago?osq=Signmaking,,,,,,,,,,
Illumination Art & Design,2600 W North Ave,Chicago,IL,60647,b/t Talman Ave & Rockwell St,"West Town, Humboldt Park",(815) 922-0959,,Sean F.,Yes,No,5.0 star rating,1 review,http://www.illuminationartanddesign.com,,Mon 9:00 am - 5:00 pm<br>Tue 9:00 am - 5:00 pm<br>Wed 9:00 am - 5:00 pm<br>Thu 9:00 am - 5:00 pm<br>Fri 9:00 am - 5:00 pm<br>Sat Closed<br>Sun Closed<br>,,,,Yes,,Street,Yes,,,,,,,,,,,,,,,,No,,,,"Signmaking, Commissioned Artists, Hobby Shops, Signmaking, Commissioned Artists, Hobby Shops",41.910485,-87.692289,"https://s3-media3.fl.yelpcdn.com/bphoto/BrV8bd86pnQsgsgynXkUzQ/ls.jpg"" srcset=""https://s3-media3.fl.yelpcdn.com/bphoto/BrV8bd86pnQsgsgynXkUzQ/258s.jpg 1.03x,https://s3-media3.fl.yelpcdn.com/bphoto/BrV8bd86pnQsgsgynXkUzQ/348s.jpg 1.39x,https://s3-media3.fl.yelpcdn.com/bphoto/BrV8bd86pnQsgsgynXkUzQ/300s.jpg 1.20x",http://www.yelp.com/biz/illumination-art-and-design-chicago?osq=Signmaking,,,,,,,smfelixart@yahoo.com,,,
Wing Sign Company,4452 W Belmont Ave,Chicago,IL,60641,b/t Kilbourn Ave & Kenneth Ave,Irving Park,(773) 777-5500,,,Yes,No,5.0 star rating,1 review,http://www.wingsign.com/,,,,,,No,,,,,,,,,,,,,,,,,,,,,,,"Printing Services, Signmaking, Graphic Design, Printing Services, Signmaking, Graphic Design",41.939190,-87.739160,"https://s3-media1.fl.yelpcdn.com/bphoto/iRktm3zLuUxARYGuWuOpsA/ls.jpg"" srcset=""https://s3-media1.fl.yelpcdn.com/bphoto/iRktm3zLuUxARYGuWuOpsA/258s.jpg 1.03x,https://s3-media1.fl.yelpcdn.com/bphoto/iRktm3zLuUxARYGuWuOpsA/348s.jpg 1.39x,https://s3-media1.fl.yelpcdn.com/bphoto/iRktm3zLuUxARYGuWuOpsA/300s.jpg 1.20x",http://www.yelp.com/biz/wing-sign-company-chicago?osq=Signmaking,,,,,,,don@wingsign.com,,,
Neon Design,3722 N Ashland Ave,Chicago,IL,60613,b/t Waveland Ave & Grace St,Lakeview,(773) 880-5020,,Charles E.,Yes,No,5.0 star rating,8 reviews,http://www.neondesign.com,,Mon 9:30 am - 5:30 pm<br>Tue 9:30 am - 5:30 pm<br>Wed 9:30 am - 5:30 pm<br>Thu 9:30 am - 5:30 pm<br>Fri 9:30 am - 5:30 pm<br>Sat Closed<br>Sun Closed<br>,,,,,,,,,,,,,,,,,,,,,,,,,,,"Advertising, Graphic Design, Signmaking, Advertising, Graphic Design, Signmaking",41.949553,-87.669252,"https://s3-media1.fl.yelpcdn.com/bphoto/rm5Ljqmszp8xGWidK3ZW3w/ls.jpg"" srcset=""https://s3-media1.fl.yelpcdn.com/bphoto/rm5Ljqmszp8xGWidK3ZW3w/258s.jpg 1.03x,https://s3-media1.fl.yelpcdn.com/bphoto/rm5Ljqmszp8xGWidK3ZW3w/348s.jpg 1.39x,https://s3-media1.fl.yelpcdn.com/bphoto/rm5Ljqmszp8xGWidK3ZW3w/300s.jpg 1.20x",http://www.yelp.com/biz/neon-design-chicago?osq=Signmaking,,,,,,,neondesignchicago@gmail.com,,,
Barry Signs,6950 W Imlay St,Chicago,IL,60631,b/t Sayre Ave & Devon Ave,Norwood Park,(773) 327-1183,,,Yes,No,4.5 star rating,3 reviews,http://www.barrysignschicago.com,,Mon 9:00 am - 6:00 pm<br>Tue 9:00 am - 6:00 pm<br>Wed 9:00 am - 6:00 pm<br>Thu 9:00 am - 6:00 pm<br>Fri 9:00 am - 6:00 pm<br>Sat 9:00 am - 1:00 pm<br>Sun Closed<br>,,,,,,,,,,,,,,,,,,,,,,,,,,,"Signmaking, Signmaking",,,"https://s3-media2.fl.yelpcdn.com/bphoto/mXMLKei9QQYNSVdPgDTc3w/ls.jpg"" srcset=""https://s3-media2.fl.yelpcdn.com/bphoto/mXMLKei9QQYNSVdPgDTc3w/258s.jpg 1.03x,https://s3-media2.fl.yelpcdn.com/bphoto/mXMLKei9QQYNSVdPgDTc3w/348s.jpg 1.39x,https://s3-media2.fl.yelpcdn.com/bphoto/mXMLKei9QQYNSVdPgDTc3w/300s.jpg 1.20x",http://www.yelp.com/biz/barry-signs-chicago?osq=Signmaking,,,,,,,,,,
,,,,,,,,,,,,,,,,,,,,,,,,,,,,,,,,,,,,,,,,,,,,,,,,,,,,,,,,,
The Sign Store,3110 W Belmont Ave,Chicago,IL,60618,b/t Albany Ave & Troy St,Avondale,(773) 904-2244,,,Yes,No,5.0 star rating,1 review,http://www.signstorechicago.com,,Mon 9:00 am - 6:00 pm<br>Tue 9:00 am - 6:00 pm<br>Wed 9:00 am - 6:00 pm<br>Thu 9:00 am - 6:00 pm<br>Fri 9:00 am - 6:00 pm<br>Sat Closed<br>Sun Closed<br>,,,,,,,,,,,,,,,,,,,,,,,,,,,"Graphic Design, Signmaking, Graphic Design, Signmaking",41.939607,-87.705770,"https://s3-media3.fl.yelpcdn.com/bphoto/7xFiQq-uwfUJmfWQc270mA/ls.jpg"" srcset=""https://s3-media3.fl.yelpcdn.com/bphoto/7xFiQq-uwfUJmfWQc270mA/258s.jpg 1.03x,https://s3-media3.fl.yelpcdn.com/bphoto/7xFiQq-uwfUJmfWQc270mA/348s.jpg 1.39x,https://s3-media3.fl.yelpcdn.com/bphoto/7xFiQq-uwfUJmfWQc270mA/300s.jpg 1.20x",http://www.yelp.com/biz/the-sign-store-chicago?osq=Signmaking,,,,,,,,,,
American Signs By Tomorrow,2834 N Halsted St Fl 1,Chicago,IL,60657,b/t George St & Wolfram St,Lakeview,(773) 404-7446,,,Yes,No,4.5 star rating,7 reviews,http://www.signsbytomorrow.com/chicagonorth,,Mon 9:00 am - 5:30 pm<br>Tue 9:00 am - 5:30 pm<br>Wed 9:00 am - 5:30 pm<br>Thu 9:00 am - 5:30 pm<br>Fri 9:00 am - 5:00 pm<br>Sat Closed<br>Sun Closed<br>,,,,,,,,,,,,,,,,,,,,,,,,,,,"Signmaking, Signmaking",41.933790,-87.649430,"https://s3-media1.fl.yelpcdn.com/bphoto/YQFf0kp5CJsEPt5NG0Wm3A/ls.jpg"" srcset=""https://s3-media1.fl.yelpcdn.com/bphoto/YQFf0kp5CJsEPt5NG0Wm3A/258s.jpg 1.03x,https://s3-media1.fl.yelpcdn.com/bphoto/YQFf0kp5CJsEPt5NG0Wm3A/348s.jpg 1.39x,https://s3-media1.fl.yelpcdn.com/bphoto/YQFf0kp5CJsEPt5NG0Wm3A/300s.jpg 1.20x",http://www.yelp.com/biz/american-signs-by-tomorrow-chicago-2?osq=Signmaking,,,,,,,,,,
Sign Studio,3645 W Irving Park Rd,Chicago,IL,60618,b/t Lawndale Ave & Elston Ave,Irving Park,(773) 509-0590,,,Yes,No,2.5 star rating,3 reviews,http://signstudiochicago.com/,,,,,,,,,,,,,,,,,,,,,,,,,,,,,"Signmaking, Signmaking",41.953457,-87.719637,"https://s3-media4.fl.yelpcdn.com/bphoto/C8wGHo00Bxq4wlV0jjmFlQ/ls.jpg"" srcset=""https://s3-media4.fl.yelpcdn.com/bphoto/C8wGHo00Bxq4wlV0jjmFlQ/258s.jpg 1.03x,https://s3-media4.fl.yelpcdn.com/bphoto/C8wGHo00Bxq4wlV0jjmFlQ/348s.jpg 1.39x,https://s3-media4.fl.yelpcdn.com/bphoto/C8wGHo00Bxq4wlV0jjmFlQ/300s.jpg 1.20x",http://www.yelp.com/biz/sign-studio-chicago?osq=Signmaking,,,,,,,signstudio00@aol.com,,,
Neon Art,4752 N Avers Ave,Chicago,IL,60625,b/t Leland Ave & Lawrence Ave,Albany Park,(773) 588-5883,,,Yes,No,5.0 star rating,3 reviews,http://www.neonartchicago.com,,,,,,,,,,,,,,,,,,,,,,,,,,,,,"Signmaking, Signmaking",41.967768,-87.724624,,http://www.yelp.com/biz/neon-art-chicago?osq=Signmaking,,,,,,,,,,
Chicagold Sign Co,,Chicago,IL,60601,,,(708) 453-2733,,Robert F.,Yes,No,5.0 star rating,2 reviews,http://www.chicagoldsigns.com,,Mon 8:30 am - 5:30 pm<br>Tue 8:30 am - 5:30 pm<br>Wed 8:30 am - 5:30 pm<br>Thu 8:30 am - 5:30 pm<br>Fri 8:30 am - 5:30 pm<br>Sat Closed<br>Sun Closed<br>,,,,,,,,,,,,,,,,,,,,,,,,,,,"Signmaking, Graphic Design, Signmaking, Graphic Design",41.921597,-87.816250,"https://s3-media3.fl.yelpcdn.com/bphoto/Z5gqZFlrX7CXa29h1Bibgg/ls.jpg"" srcset=""https://s3-media3.fl.yelpcdn.com/bphoto/Z5gqZFlrX7CXa29h1Bibgg/258s.jpg 1.03x,https://s3-media3.fl.yelpcdn.com/bphoto/Z5gqZFlrX7CXa29h1Bibgg/348s.jpg 1.39x,https://s3-media3.fl.yelpcdn.com/bphoto/Z5gqZFlrX7CXa29h1Bibgg/300s.jpg 1.20x",http://www.yelp.com/biz/chicagold-sign-co-chicago?osq=Signmaking,,,,,,,,,,
Gr33nInk,6251 N Claremont Ave Ste 1,Chicago,IL,60659,b/t Rosemont Ave & Granville Ave,West Rogers Park,(773) 750-1050,,Andres Q.,Yes,No,5.0 star rating,1 review,http://www.gr33nink.com/,,Mon 10:00 am - 7:00 pm<br>Tue Closed<br>Wed 10:00 am - 7:00 pm<br>Thu 10:00 am - 7:00 pm<br>Fri 10:00 am - 7:00 pm<br>Sat 10:00 am - 5:00 pm<br>Sun 10:00 am - 5:00 pm<br>,,,,Yes,,,,,,,,,,,,,,,,,,,,,,,"IT Services & Computer Repair, Signmaking, Web Design, IT Services & Computer Repair, Signmaking, Web Design",41.995620,-87.688378,"https://s3-media3.fl.yelpcdn.com/bphoto/shTZuHC6H0j_X8GBltUoiQ/ls.jpg"" srcset=""https://s3-media3.fl.yelpcdn.com/bphoto/shTZuHC6H0j_X8GBltUoiQ/258s.jpg 1.03x,https://s3-media3.fl.yelpcdn.com/bphoto/shTZuHC6H0j_X8GBltUoiQ/348s.jpg 1.39x,https://s3-media3.fl.yelpcdn.com/bphoto/shTZuHC6H0j_X8GBltUoiQ/300s.jpg 1.20x",http://www.yelp.com/biz/gr33nink-chicago?osq=Signmaking,,,,,,,Andres@gr33nink.com,,,
The Wooden Sign,1811 W Cornelia Ave,Chicago,IL,60657,at Ravenswood Ave,"Roscoe Village, Lakeview",(773) 348-1313,,,Yes,No,5.0 star rating,1 review,,,,,,,,,,,,,,,,,,,,,,,,,,,,,,"Signmaking, Metal Fabricators, Signmaking, Metal Fabricators",41.944850,-87.674422,,http://www.yelp.com/biz/the-wooden-sign-chicago?osq=Signmaking,,,,,,,,,,
Cushing,213 W Institute Pl Ste 200,Chicago,IL,60610,b/t Franklin St & Wells St,Near North Side,(312) 266-8228,,,Yes,No,4.5 star rating,6 reviews,https://www.cushingco.com,,Mon 7:00 am - 6:00 pm<br>Tue 7:00 am - 6:00 pm<br>Wed 7:00 am - 6:00 pm<br>Thu 7:00 am - 6:00 pm<br>Fri 7:00 am - 6:00 pm<br>Sat Closed<br>Sun Closed<br>,,,,Yes,,,,,,,,,,,,,,,,,,,,,,,"Printing Services, Signmaking, Duplication Services, Printing Services, Signmaking, Duplication Services",,,"https://s3-media1.fl.yelpcdn.com/bphoto/Arti7PAjKaWDH__xFqQLYA/ls.jpg"" srcset=""https://s3-media1.fl.yelpcdn.com/bphoto/Arti7PAjKaWDH__xFqQLYA/258s.jpg 1.03x,https://s3-media1.fl.yelpcdn.com/bphoto/Arti7PAjKaWDH__xFqQLYA/348s.jpg 1.39x,https://s3-media1.fl.yelpcdn.com/bphoto/Arti7PAjKaWDH__xFqQLYA/300s.jpg 1.20x",http://www.yelp.com/biz/cushing-chicago?osq=Signmaking,,,,,,,,,,
,,,,,,,,,,,,,,,,,,,,,,,,,,,,,,,,,,,,,,,,,,,,,,,,,,,,,,,,,
