Name,Street Address,City,State,Zip Code,Cross Streets,Neighborhood,Phone,Description,Business Owner,Merchant Verified,Paid Listing,Rating,Reviews,Website,Price Range,Hours,Takes Reservations,Delivery,Take Out,Accepts Credit Cards,Good For,Parking,Wheelchair Accessable,Good For Kids,Good For Groups,Attire,Ambience,Noise Level,Music,Dancing,Serves Alcohol,Happy Hour,Best Nights,Coat Check,Smoking Allowed,Outdoor Seating,Wifi,Has Tv,Allows Dogs,Waiter Service,Caters,By Appointment Only,Category,Lat,Long,Image URL,Listing URL,Deal,Deal Description,Deal Orignal Price,Deal Discount,Deal Savings,Deal Link,Email from Web,Facebook URL,Twitter URL,Google Plus URL
High Power Digital Display,8457 S Pulaski Rd,Chicago,IL,60652,b/t 84th Pl & 85th St,Ashburn,(773) 617-5070,,,Yes,No,,,http://www.high-powerdd.com,,Mon 12:00 pm - 5:00 pm<br>Tue 12:00 pm - 5:00 pm<br>Wed 12:00 pm - 5:00 pm<br>Thu 12:00 pm - 5:00 pm<br>Fri 12:00 pm - 5:00 pm<br>Sat 12:00 pm - 4:00 pm<br>Sun Closed<br>,,,,Yes,,,,,,,,,,,,,,,,,,,,,,Yes,"Signmaking, IT Services & Computer Repair, Security Systems, Signmaking, IT Services & Computer Repair, Security Systems",,,"https://s3-media4.fl.yelpcdn.com/bphoto/kWtIpBrKSNq2YRXJK0MGAQ/ls.jpg"" srcset=""https://s3-media4.fl.yelpcdn.com/bphoto/kWtIpBrKSNq2YRXJK0MGAQ/258s.jpg 1.03x,https://s3-media4.fl.yelpcdn.com/bphoto/kWtIpBrKSNq2YRXJK0MGAQ/348s.jpg 1.39x,https://s3-media4.fl.yelpcdn.com/bphoto/kWtIpBrKSNq2YRXJK0MGAQ/300s.jpg 1.20x",http://www.yelp.com/biz/high-power-digital-display-chicago?osq=Signmaking,,,,,,,,,,
Signs3,207 S Gail Ct,Prospect Heights,IL,60070,,,(847) 222-0505,,,Yes,No,5.0 star rating,1 review,http://www.signs3.com,,Mon 7:00 am - 5:00 pm<br>Tue 7:00 am - 5:00 pm<br>Wed 7:00 am - 5:00 pm<br>Thu 7:00 am - 5:00 pm<br>Fri 7:00 am - 5:00 pm<br>Sat 8:00 am - 5:00 pm<br>Sun 8:00 am - 5:00 pm<br>,,,,,,,,,,,,,,,,,,,,,,,,,,,"Signmaking, Signmaking",42.099086,-87.955094,,http://www.yelp.com/biz/signs3-prospect-heights?osq=Signmaking,,,,,,,,,,
Signarama,100 E Roosevelt Rd,Villa Park,IL,60181,,,(630) 359-5929,,,Yes,No,4.0 star rating,1 review,http://www.Signarama.com/il-villa-park,,Mon 8:30 am - 5:00 pm<br>Tue 8:30 am - 5:00 pm<br>Wed 8:30 am - 5:00 pm<br>Thu 8:30 am - 5:00 pm<br>Fri 8:30 am - 5:00 pm<br>Sat Closed<br>Sun Closed<br>,,,,Yes,,,,,,,,,,,,,,,,,,,,,,,"Graphic Design, Signmaking, Vehicle Wraps, Graphic Design, Signmaking, Vehicle Wraps",,,"https://s3-media1.fl.yelpcdn.com/bphoto/57M6-znp7x9XeLImFBUQOA/ls.jpg"" srcset=""https://s3-media1.fl.yelpcdn.com/bphoto/57M6-znp7x9XeLImFBUQOA/258s.jpg 1.03x,https://s3-media1.fl.yelpcdn.com/bphoto/57M6-znp7x9XeLImFBUQOA/348s.jpg 1.39x,https://s3-media1.fl.yelpcdn.com/bphoto/57M6-znp7x9XeLImFBUQOA/300s.jpg 1.20x",http://www.yelp.com/biz/signarama-villa-park?osq=Signmaking,$95 for $125 Deal at Signarama,You get a voucher redeemable for $125 at Signarama.,$125,24%,$30,https://www.yelp.com/checkout/deal/3kY6iMQP-0eD9y7kT7EheQ?biz_id=_PC8xcWJgT6A_YchImdDrA&return_url=%2Fbiz%2Fsignarama-villa-park,,,,
SIR Speedy -Rosemont,6111 N River Rd,Rosemont,IL,60018,,O'Hare,(847) 292-2679,,,Yes,No,,,http://www.sirspeedy.com/rosemontil320/,,Mon 9:00 am - 5:00 pm<br>Tue 9:00 am - 5:00 pm<br>Wed 9:00 am - 5:00 pm<br>Thu 9:00 am - 5:00 pm<br>Fri 9:00 am - 5:00 pm<br>Sat Closed<br>Sun Closed<br>,,,,,,,,,,,,,,,,,,,,,,,,,,,"Marketing, Printing Services, Signmaking, Marketing, Printing Services, Signmaking",41.990243,-87.859831,,http://www.yelp.com/biz/sir-speedy-rosemont-rosemont-2?osq=Signmaking,,,,,,,,,,
Element Graphics & Designs,19233 Henry Dr,Mokena,IL,60448,,,(708) 478-6650,,,Yes,No,,,http://www.elementgraphics.com,,Mon 8:00 am - 4:30 pm<br>Tue 8:00 am - 4:30 pm<br>Wed 8:00 am - 4:30 pm<br>Thu 8:00 am - 4:30 pm<br>Fri 8:00 am - 4:30 pm<br>Sat Closed<br>Sun Closed<br>,,,,Yes,,,,,,,,,,,,,,,,,,,,,,,"Graphic Design, Vehicle Wraps, Signmaking, Graphic Design, Vehicle Wraps, Signmaking",,,"https://s3-media1.fl.yelpcdn.com/bphoto/MvU-9cKyaYkNz_8PpRx_ZQ/ls.jpg"" srcset=""https://s3-media1.fl.yelpcdn.com/bphoto/MvU-9cKyaYkNz_8PpRx_ZQ/258s.jpg 1.03x,https://s3-media1.fl.yelpcdn.com/bphoto/MvU-9cKyaYkNz_8PpRx_ZQ/348s.jpg 1.39x,https://s3-media1.fl.yelpcdn.com/bphoto/MvU-9cKyaYkNz_8PpRx_ZQ/300s.jpg 1.20x",http://www.yelp.com/biz/element-graphics-and-designs-mokena?osq=Signmaking,,,,,,,,,,
BTR Marketing & Design,,Riverside,IL,60546,,,(708) 606-1387,,Brad R.,Yes,No,,,http://www.btrmarketinginc.com,,Mon 9:00 am - 9:00 pm<br>Tue 9:00 am - 9:00 pm<br>Wed 9:00 am - 9:00 pm<br>Thu 9:00 am - 9:00 pm<br>Fri 9:00 am - 9:00 pm<br>Sat 9:00 am - 9:00 pm<br>Sun 9:00 am - 9:00 pm<br>,,,,,,,,,,,,,,,,,,,,,,,,,,,"Marketing, Web Design, Signmaking, Marketing, Web Design, Signmaking",,,"https://s3-media4.fl.yelpcdn.com/bphoto/Qow2npa3oi4fdFrceL0lBA/ls.jpg"" srcset=""https://s3-media4.fl.yelpcdn.com/bphoto/Qow2npa3oi4fdFrceL0lBA/258s.jpg 1.03x,https://s3-media4.fl.yelpcdn.com/bphoto/Qow2npa3oi4fdFrceL0lBA/348s.jpg 1.39x,https://s3-media4.fl.yelpcdn.com/bphoto/Qow2npa3oi4fdFrceL0lBA/300s.jpg 1.20x",http://www.yelp.com/biz/btr-marketing-and-design-riverside-2?osq=Signmaking,,,,,,,,,,
FedEx Office Print & Ship Center,2518 Green Bay Rd,Evanston,IL,60201,,,(847) 475-8650,"FedEx Office in Evanston, IL provides a one-stop shop for small businesses printing and shipping expertise and reliable customer service when and where you need it. Services include …Learn more about FedEx Office Print & Ship Center, Opens a popupSpecialtiesFedEx Office in Evanston, IL provides a one-stop shop for small businesses printing and shipping expertise and reliable customer service when and where you need it. Services include copying and digital printing, direct mail, signs and graphics, Internet access, computer rental, fax services, passport photos, FedEx Express and FedEx Ground shipping.Upload documents with FedEx Office Print Online, and have your flyers, brochures, presentations or signs ready for convenient pick-up or delivery.FedEx Kinko's is now FedEx Office.HistoryEstablished in 1970.FedEx Office (formerly FedEx Kinko's) provides access points to printing and shipping expertise with reliable service when and where you need it. The Dallas-based company has a network of more than 1,900 digitally-connected locations.FedEx Office services include copying and digital printing, professional finishing, document creation, direct mail, signs and graphics, Internet access, computer rental, FedEx Express and FedEx Ground shipping, and more.In addition, the company offers FedEx Office Print Online, an online printing solution for business and personal printing, at home, at the office or on the go.More than 200 locations operate 24 hours a day every day of the week.",,Yes,No,3.0 star rating,22 reviews,http://local.fedex.com/il/evanston/office-3605/%3Fcmp%3DLOC-1001545-3-1-971-1110000-US-US-EN-YEXTLISTFXOPRSC,,Mon 7:00 am - 10:00 pm<br>Tue 7:00 am - 10:00 pm<br>Wed 7:00 am - 10:00 pm<br>Thu 7:00 am - 10:00 pm<br>Fri 7:00 am - 10:00 pm<br>Sat 8:00 am - 8:00 pm<br>Sun 10:00 am - 8:00 pm<br>,,,,Yes,,,,,,,,,,,,,,,,,,,,,,,"Shipping Centers, Printing Services, Signmaking, Shipping Centers, Printing Services, Signmaking",42.063073,-87.698313,"https://s3-media4.fl.yelpcdn.com/bphoto/s0v-ST9k70UNHnZ2KuGlcA/ls.jpg"" srcset=""https://s3-media4.fl.yelpcdn.com/bphoto/s0v-ST9k70UNHnZ2KuGlcA/258s.jpg 1.03x,https://s3-media4.fl.yelpcdn.com/bphoto/s0v-ST9k70UNHnZ2KuGlcA/348s.jpg 1.39x,https://s3-media4.fl.yelpcdn.com/bphoto/s0v-ST9k70UNHnZ2KuGlcA/300s.jpg 1.20x",http://www.yelp.com/biz/fedex-office-print-and-ship-center-evanston?osq=Signmaking,,,,,,,,,,
Fast Signs,1701 Howard St Ste C,Elk Grove Village,IL,60007,at Busse Rd,,(847) 981-1965,,,Yes,No,3.5 star rating,4 reviews,https://www.fastsigns.com/341-elk-grove-village-il,,Mon 9:00 am - 5:00 pm<br>Tue 9:00 am - 5:00 pm<br>Wed 9:00 am - 5:00 pm<br>Thu 9:00 am - 5:00 pm<br>Fri 9:00 am - 5:00 pm<br>Sat Closed<br>Sun Closed<br>,,,,Yes,,,,,,,,,,,,,,,,,,,,,,,"Printing Services, Signmaking, Graphic Design, Printing Services, Signmaking, Graphic Design",42.015634,-87.958672,"https://s3-media2.fl.yelpcdn.com/bphoto/vUeQH20v3V-LcLyk2wx9YQ/ls.jpg"" srcset=""https://s3-media2.fl.yelpcdn.com/bphoto/vUeQH20v3V-LcLyk2wx9YQ/258s.jpg 1.03x,https://s3-media2.fl.yelpcdn.com/bphoto/vUeQH20v3V-LcLyk2wx9YQ/348s.jpg 1.39x,https://s3-media2.fl.yelpcdn.com/bphoto/vUeQH20v3V-LcLyk2wx9YQ/300s.jpg 1.20x",http://www.yelp.com/biz/fast-signs-elk-grove-village-7?osq=Signmaking,,,,,,,,,,
Antwique Shop,2900 W Carroll Ave,Chicago,IL,60612,b/t Sacramento Blvd & Francisco Ave,East Garfield Park,(309) 752-8060,,,Yes,No,,,http://www.antwiqueshop.com,,,,,,,,,,,,,,,,,,,,,,,,,,,,,"Signmaking, Carpenters, Signmaking, Carpenters",41.887946,-87.699092,,http://www.yelp.com/biz/antwique-shop-chicago?osq=Signmaking,,,,,,,,,,
Rutke Signs,1 Westbrook Corporate Ctr Ste 300,Westchester,IL,60154,,,(708) 841-6464,,,Yes,No,,,http://www.signslabelsandtags.com,,,,,,,,,,,,,,,,,,,,,,,,,,,,,"Graphic Design, Signmaking, Graphic Design, Signmaking",41.846869,-87.905589,"https://s3-media1.fl.yelpcdn.com/bphoto/tZzby_6lR3Alw7KP4b43XQ/ls.jpg"" srcset=""https://s3-media1.fl.yelpcdn.com/bphoto/tZzby_6lR3Alw7KP4b43XQ/258s.jpg 1.03x,https://s3-media1.fl.yelpcdn.com/bphoto/tZzby_6lR3Alw7KP4b43XQ/348s.jpg 1.39x,https://s3-media1.fl.yelpcdn.com/bphoto/tZzby_6lR3Alw7KP4b43XQ/300s.jpg 1.20x",http://www.yelp.com/biz/rutke-signs-westchester-2?osq=Signmaking,,,,,,,your@email.com,,,
Bannerville USA Inc,8164-66 S Madison St,Burr Ridge,IL,60527,,,(630) 455-0304,,Patti S.,Yes,No,5.0 star rating,1 review,http://www.bannerville.com,,Mon 7:00 am - 4:30 pm<br>Tue 7:00 am - 4:30 pm<br>Wed 7:00 am - 4:30 pm<br>Thu 7:00 am - 4:30 pm<br>Fri 7:00 am - 4:30 pm<br>Sat Closed<br>Sun Closed<br>,,,,Yes,,,,,,,,,,,,,,,,,,,,,,,"Graphic Design, Signmaking, Printing Services, Graphic Design, Signmaking, Printing Services",41.740551,-87.934658,"https://s3-media4.fl.yelpcdn.com/bphoto/CR48-nBSLxs67a90lNh5iQ/ls.jpg"" srcset=""https://s3-media4.fl.yelpcdn.com/bphoto/CR48-nBSLxs67a90lNh5iQ/258s.jpg 1.03x,https://s3-media4.fl.yelpcdn.com/bphoto/CR48-nBSLxs67a90lNh5iQ/348s.jpg 1.39x,https://s3-media4.fl.yelpcdn.com/bphoto/CR48-nBSLxs67a90lNh5iQ/300s.jpg 1.20x",http://www.yelp.com/biz/bannerville-usa-inc-burr-ridge?osq=Signmaking,,,,,,,info@bannerville.com,,,
Signarama,350 Lexington Dr,Buffalo Grove,IL,60089,,,(847) 215-1535,,,Yes,No,5.0 star rating,1 review,http://www.bgsignarama.com/,,Mon 8:30 am - 5:00 pm<br>Tue 8:30 am - 5:00 pm<br>Wed 8:30 am - 5:00 pm<br>Thu 8:30 am - 5:00 pm<br>Fri 8:30 am - 5:00 pm<br>Sat Closed<br>Sun Closed<br>,,,,Yes,,,,,,,,,,,,,,,,,,,,,,,"Signmaking, Graphic Design, Vehicle Wraps, Signmaking, Graphic Design, Vehicle Wraps",42.159304,-87.943258,,http://www.yelp.com/biz/signarama-buffalo-grove?osq=Signmaking,,,,,,,,,,
Signs Today,342 W Colfax St,Palatine,IL,60067,b/t Schubert St & United States Highway 14,,(847) 934-9777,,,Yes,No,4.5 star rating,3 reviews,http://signstodayproducts.com/,,Mon 8:30 am - 5:00 pm<br>Tue 8:30 am - 5:00 pm<br>Wed 8:30 am - 5:00 pm<br>Thu 8:30 am - 5:00 pm<br>Fri 8:30 am - 5:00 pm<br>Sat Closed<br>Sun Closed<br>,,,,,,,,,,,,,,,,,,,,,,,,,,,"Vehicle Wraps, Signmaking, Graphic Design, Vehicle Wraps, Signmaking, Graphic Design",42.116319,-88.052921,"https://s3-media3.fl.yelpcdn.com/bphoto/QrxRIWZFwLRi-I2k1tv9LA/ls.jpg"" srcset=""https://s3-media3.fl.yelpcdn.com/bphoto/QrxRIWZFwLRi-I2k1tv9LA/258s.jpg 1.03x,https://s3-media3.fl.yelpcdn.com/bphoto/QrxRIWZFwLRi-I2k1tv9LA/348s.jpg 1.39x,https://s3-media3.fl.yelpcdn.com/bphoto/QrxRIWZFwLRi-I2k1tv9LA/300s.jpg 1.20x",http://www.yelp.com/biz/signs-today-palatine-2?osq=Signmaking,,,,,,,sales@signstodayproducts.com,,,
National Awards & Fine Gifts,836 Custer Ave,Evanston,IL,60202,b/t Main St & Washington St,,(847) 475-2207,,,Yes,No,,,http://www.nationalawardandgift.com,Moderate,Mon Closed<br>Tue 10:00 am - 6:00 pm<br>Wed 10:00 am - 6:00 pm<br>Thu 10:00 am - 6:00 pm<br>Fri 10:00 am - 6:00 pm<br>Sat 10:00 am - 2:00 pm<br>Sun Closed<br>,,,,Yes,,Street,,,,,,,,,,,,,,,,,,,,,"Signmaking, Trophy Shops, Engraving, Signmaking, Trophy Shops, Engraving",42.033459,-87.680572,"https://s3-media1.fl.yelpcdn.com/bphoto/vLwIUi4XbPaJ66XZ0--BmQ/ls.jpg"" srcset=""https://s3-media1.fl.yelpcdn.com/bphoto/vLwIUi4XbPaJ66XZ0--BmQ/258s.jpg 1.03x,https://s3-media1.fl.yelpcdn.com/bphoto/vLwIUi4XbPaJ66XZ0--BmQ/348s.jpg 1.39x,https://s3-media1.fl.yelpcdn.com/bphoto/vLwIUi4XbPaJ66XZ0--BmQ/300s.jpg 1.20x",http://www.yelp.com/biz/national-awards-and-fine-gifts-evanston-2?osq=Signmaking,,,,,,,,,,
FedEx Office Print & Ship Center,1800 W North Ave,Chicago,IL,60622,b/t Honore St & Wood St,"Wicker Park, West Town",(773) 395-4639,"FedEx Office in Chicago, IL provides a one-stop shop for small businesses printing and shipping expertise and reliable customer service when and where you need it. Services include …Learn more about FedEx Office Print & Ship Center, Opens a popupSpecialtiesFedEx Office in Chicago, IL provides a one-stop shop for small businesses printing and shipping expertise and reliable customer service when and where you need it. Services include copying and digital printing, direct mail, signs and graphics, Internet access, computer rental, fax services, passport photos, FedEx Express and FedEx Ground shipping.Upload documents with FedEx Office Print Online, and have your flyers, brochures, presentations or signs ready for convenient pick-up or delivery.FedEx Kinko's is now FedEx Office.HistoryEstablished in 1970.FedEx Office (formerly FedEx Kinko's) provides access points to printing and shipping expertise with reliable service when and where you need it. The Dallas-based company has a network of more than 1,900 digitally-connected locations.FedEx Office services include copying and digital printing, professional finishing, document creation, direct mail, signs and graphics, Internet access, computer rental, FedEx Express and FedEx Ground shipping, and more.In addition, the company offers FedEx Office Print Online, an online printing solution for business and personal printing, at home, at the office or on the go.More than 200 locations operate 24 hours a day every day of the week.",,Yes,No,2.0 star rating,70 reviews,http://local.fedex.com/il/chicago/office-3634/%3Fcmp%3DLOC-1001545-3-1-971-1110000-US-US-EN-YEXTLISTFXOPRSC,,Mon Open 24 hours<br>Tue Open 24 hours<br>Wed Open 24 hours<br>Thu Open 24 hours<br>Fri Open 24 hours<br>Sat Open 24 hours<br>Sun Open 24 hours<br>,,,,Yes,,,,,,,,,,,,,,,,,,,,,,,"Shipping Centers, Printing Services, Signmaking, Shipping Centers, Printing Services, Signmaking",41.910767,-87.672967,"https://s3-media3.fl.yelpcdn.com/bphoto/eoYn4YW431BxPuj7BHT10Q/ls.jpg"" srcset=""https://s3-media3.fl.yelpcdn.com/bphoto/eoYn4YW431BxPuj7BHT10Q/258s.jpg 1.03x,https://s3-media3.fl.yelpcdn.com/bphoto/eoYn4YW431BxPuj7BHT10Q/348s.jpg 1.39x,https://s3-media3.fl.yelpcdn.com/bphoto/eoYn4YW431BxPuj7BHT10Q/300s.jpg 1.20x",http://www.yelp.com/biz/fedex-office-print-and-ship-center-chicago-28?osq=Signmaking,,,,,,,,,,
Sign & Banner Express,540 E Boughton Rd,Bolingbrook,IL,60440,,,(630) 783-9700,,,Yes,No,5.0 star rating,1 review,,,,,,,,,,,,,,,,,,,,,,,,,,,,,,"Signmaking, Signmaking",41.718347,-88.049714,,http://www.yelp.com/biz/sign-and-banner-express-bolingbrook?osq=Signmaking,,,,,,,,,,
ABC Stork Etc,9212 Marmora Ave,Morton Grove,IL,60053,b/t Lyons St & Church St,,(847) 965-2229,,,No,No,,,http://www.abcstorks.com,,,,,,,,,,,,,,,,,,,,,,,,,,,,,"Signmaking, Signmaking",42.048710,-87.774064,,http://www.yelp.com/biz/abc-stork-etc-morton-grove?osq=Signmaking,,,,,,,info@abcstorksetc.com,,,
Correct Digital Displays,3677 Il Rt 71,Sheridan,IL,60551,,,(815) 695-1000,,,Yes,No,,,http://www.correctdd.com,,Mon 7:00 am - 5:00 pm<br>Tue 7:00 am - 5:00 pm<br>Wed 7:00 am - 5:00 pm<br>Thu 7:00 am - 5:00 pm<br>Fri 7:00 am - 5:00 pm<br>Sat Closed<br>Sun Closed<br>,,,,,,,,,,,,,,,,,,,,,,,,,,,"Signmaking, Signmaking",,,,http://www.yelp.com/biz/correct-digital-displays-sheridan?osq=Signmaking,,,,,,,Becky@CorrectDD.com,,,
FedEx Office Print & Ship Center,11235 W 22nd St,Westchester,IL,60154,,,(708) 947-2894,,,Yes,No,1.0 star rating,2 reviews,http://local.fedex.com/il/westchester/office-1415/%3Fcmp%3DLOC-1001545-3-1-971-1110000-US-US-EN-YEXTLISTFXOPRSC,,Mon 7:30 am - 9:00 pm<br>Tue 7:30 am - 9:00 pm<br>Wed 7:30 am - 9:00 pm<br>Thu 7:30 am - 9:00 pm<br>Fri 7:30 am - 9:00 pm<br>Sat 8:00 am - 6:00 pm<br>Sun 12:00 pm - 6:00 pm<br>,,,,Yes,,,,,,,,,,,,,,,,,,,,,,,"Shipping Centers, Printing Services, Signmaking, Shipping Centers, Printing Services, Signmaking",41.847490,-87.903534,"https://s3-media4.fl.yelpcdn.com/bphoto/LysU1-YNLkuBSRSKCVJ4og/ls.jpg"" srcset=""https://s3-media4.fl.yelpcdn.com/bphoto/LysU1-YNLkuBSRSKCVJ4og/258s.jpg 1.03x,https://s3-media4.fl.yelpcdn.com/bphoto/LysU1-YNLkuBSRSKCVJ4og/348s.jpg 1.39x,https://s3-media4.fl.yelpcdn.com/bphoto/LysU1-YNLkuBSRSKCVJ4og/300s.jpg 1.20x",http://www.yelp.com/biz/fedex-office-print-and-ship-center-westchester?osq=Signmaking,,,,,,,,,,
FedEx Office Print & Ship Center,1 S Sangamon St,Chicago,IL,60607,b/t Madison St & Washington Blvd,"West Loop, Near West Side",(312) 492-8355,"FedEx Office in Chicago, IL provides a one-stop shop for small businesses printing and shipping expertise and reliable customer service when and where you need it. Services include …Learn more about FedEx Office Print & Ship Center, Opens a popupSpecialtiesFedEx Office in Chicago, IL provides a one-stop shop for small businesses printing and shipping expertise and reliable customer service when and where you need it. Services include copying and digital printing, direct mail, signs and graphics, Internet access, computer rental, fax services, passport photos, FedEx Express and FedEx Ground shipping.Upload documents with FedEx Office Print Online, and have your flyers, brochures, presentations or signs ready for convenient pick-up or delivery.FedEx Kinko's is now FedEx Office.HistoryEstablished in 1970.FedEx Office (formerly FedEx Kinko's) provides access points to printing and shipping expertise with reliable service when and where you need it. The Dallas-based company has a network of more than 1,900 digitally-connected locations.FedEx Office services include copying and digital printing, professional finishing, document creation, direct mail, signs and graphics, Internet access, computer rental, FedEx Express and FedEx Ground shipping, and more.In addition, the company offers FedEx Office Print Online, an online printing solution for business and personal printing, at home, at the office or on the go.More than 200 locations operate 24 hours a day every day of the week.",,Yes,No,2.0 star rating,32 reviews,http://local.fedex.com/il/chicago/office-1737/%3Fcmp%3DLOC-1001545-3-1-971-1110000-US-US-EN-YEXTLISTFXOPRSC,,Mon 7:30 am - 9:00 pm<br>Tue 7:30 am - 9:00 pm<br>Wed 7:30 am - 9:00 pm<br>Thu 7:30 am - 9:00 pm<br>Fri 7:30 am - 9:00 pm<br>Sat 8:00 am - 6:00 pm<br>Sun 12:00 pm - 6:00 pm<br>,,,,Yes,,,,,,,,,,,,,,,,,,,,,,,"Printing Services, Shipping Centers, Signmaking, Printing Services, Shipping Centers, Signmaking",41.881527,-87.650662,"https://s3-media3.fl.yelpcdn.com/bphoto/SLyDUlmMMAqDHTzSrLb47Q/ls.jpg"" srcset=""https://s3-media3.fl.yelpcdn.com/bphoto/SLyDUlmMMAqDHTzSrLb47Q/258s.jpg 1.03x,https://s3-media3.fl.yelpcdn.com/bphoto/SLyDUlmMMAqDHTzSrLb47Q/348s.jpg 1.39x,https://s3-media3.fl.yelpcdn.com/bphoto/SLyDUlmMMAqDHTzSrLb47Q/300s.jpg 1.20x",http://www.yelp.com/biz/fedex-office-print-and-ship-center-chicago-16?osq=Signmaking,,,,,,,,,,
FedEx Office Print & Ship Center,117 W Rand Rd,Arlington Heights,IL,60004,b/t Chestnut Ave & Arlington Heights Rd,,(847) 670-4100,"FedEx Office in Arlington Heights, IL provides a one-stop shop for small businesses printing and shipping expertise and reliable customer service when and where you need it. Services …Learn more about FedEx Office Print & Ship Center, Opens a popupSpecialtiesFedEx Office in Arlington Heights, IL provides a one-stop shop for small businesses printing and shipping expertise and reliable customer service when and where you need it. Services include copying and digital printing, direct mail, signs and graphics, Internet access, computer rental, fax services, passport photos, FedEx Express and FedEx Ground shipping.Upload documents with FedEx Office Print Online, and have your flyers, brochures, presentations or signs ready for convenient pick-up or delivery.FedEx Kinko's is now FedEx Office.HistoryEstablished in 1970.FedEx Office (formerly FedEx Kinko's) provides access points to printing and shipping expertise with reliable service when and where you need it. The Dallas-based company has a network of more than 1,900 digitally-connected locations.FedEx Office services include copying and digital printing, professional finishing, document creation, direct mail, signs and graphics, Internet access, computer rental, FedEx Express and FedEx Ground shipping, and more.In addition, the company offers FedEx Office Print Online, an online printing solution for business and personal printing, at home, at the office or on the go.More than 200 locations operate 24 hours a day every day of the week.",,Yes,No,3.0 star rating,13 reviews,http://local.fedex.com/il/arlington-heights/office-3626/%3Fcmp%3DLOC-1001545-3-1-971-1110000-US-US-EN-YEXTLISTFXOPRSC,,Mon 7:00 am - 10:00 pm<br>Tue 7:00 am - 10:00 pm<br>Wed 7:00 am - 10:00 pm<br>Thu 7:00 am - 10:00 pm<br>Fri 7:00 am - 10:00 pm<br>Sat 8:00 am - 8:00 pm<br>Sun 10:00 am - 8:00 pm<br>,,,,Yes,,,,,,,,,,,,,,,,,,,,,,,"Printing Services, Shipping Centers, Signmaking, Printing Services, Shipping Centers, Signmaking",42.115482,-87.985714,"https://s3-media3.fl.yelpcdn.com/bphoto/d5gsPQ6YjwrVvXd-khU1lw/ls.jpg"" srcset=""https://s3-media3.fl.yelpcdn.com/bphoto/d5gsPQ6YjwrVvXd-khU1lw/258s.jpg 1.03x,https://s3-media3.fl.yelpcdn.com/bphoto/d5gsPQ6YjwrVvXd-khU1lw/348s.jpg 1.39x,https://s3-media3.fl.yelpcdn.com/bphoto/d5gsPQ6YjwrVvXd-khU1lw/300s.jpg 1.20x",http://www.yelp.com/biz/fedex-office-print-and-ship-center-arlington-heights?osq=Signmaking,,,,,,,,,,
Signarama,1161 Lee St,Des Plaines,IL,60016,,,(847) 824-2550,,,Yes,No,,,http://www.signarama.com/il-des-plaines,,Mon 8:00 am - 5:00 pm<br>Tue 8:00 am - 5:00 pm<br>Wed 8:00 am - 5:00 pm<br>Thu 8:00 am - 5:00 pm<br>Fri 8:00 am - 5:00 pm<br>Sat Closed<br>Sun Closed<br>,,,,Yes,,,,,,,,,,,,,,,,,,,,,,,"Printing Services, Signmaking, Graphic Design, Printing Services, Signmaking, Graphic Design",42.032005,-87.893876,"https://s3-media4.fl.yelpcdn.com/bphoto/l9tn2ObvlL8E2yoUKckyEA/ls.jpg"" srcset=""https://s3-media4.fl.yelpcdn.com/bphoto/l9tn2ObvlL8E2yoUKckyEA/258s.jpg 1.03x,https://s3-media4.fl.yelpcdn.com/bphoto/l9tn2ObvlL8E2yoUKckyEA/348s.jpg 1.39x,https://s3-media4.fl.yelpcdn.com/bphoto/l9tn2ObvlL8E2yoUKckyEA/300s.jpg 1.20x",http://www.yelp.com/biz/signarama-des-plaines?osq=Signmaking,,,,,,,,,,
JAM! Graphics,627 Superior Dr,Romeoville,IL,60446,,,(708) 717-2889,,,Yes,No,,,http://www.graphixbyjam.com,,Mon 8:00 am - 5:00 pm<br>Tue 8:00 am - 5:00 pm<br>Wed 8:00 am - 5:00 pm<br>Thu 8:00 am - 5:00 pm<br>Fri 8:00 am - 5:00 pm<br>Sat Closed<br>Sun Closed<br>,,,,,,,,,,,,,,,,,,,,,,,,,,,"Signmaking, Printing Services, Graphic Design, Signmaking, Printing Services, Graphic Design",,,"https://s3-media2.fl.yelpcdn.com/bphoto/Sa3yYN89ph0nNE-3wfRiBg/ls.jpg"" srcset=""https://s3-media2.fl.yelpcdn.com/bphoto/Sa3yYN89ph0nNE-3wfRiBg/258s.jpg 1.03x,https://s3-media2.fl.yelpcdn.com/bphoto/Sa3yYN89ph0nNE-3wfRiBg/348s.jpg 1.39x,https://s3-media2.fl.yelpcdn.com/bphoto/Sa3yYN89ph0nNE-3wfRiBg/300s.jpg 1.20x",http://www.yelp.com/biz/jam-graphics-romeoville?osq=Signmaking,,,,,,,,,,
Hi-Impact Signs,,Elmhurst,IL,60126,,,(630) 921-0132,,Roger Z.,Yes,No,,,http://www.hi-impactsigns.net,,,,,,,,,,,,,,,,,,,,,,,,,,,,,"Advertising, Signmaking, Advertising, Signmaking",,,"https://s3-media3.fl.yelpcdn.com/bphoto/NGd-IHyKRswD3KiBteDs4g/ls.jpg"" srcset=""https://s3-media3.fl.yelpcdn.com/bphoto/NGd-IHyKRswD3KiBteDs4g/258s.jpg 1.03x,https://s3-media3.fl.yelpcdn.com/bphoto/NGd-IHyKRswD3KiBteDs4g/348s.jpg 1.39x,https://s3-media3.fl.yelpcdn.com/bphoto/NGd-IHyKRswD3KiBteDs4g/300s.jpg 1.20x",http://www.yelp.com/biz/hi-impact-signs-elmhurst?osq=Signmaking,,,,,,,,,,
Sign Co Plus,920 N Ridge Ave Ste B3,Lombard,IL,60148,,,(708) 655-7446,,Ercan C.,Yes,No,,,,,Mon 8:00 am - 4:00 pm<br>Tue 8:00 am - 4:00 pm<br>Wed 8:00 am - 4:00 pm<br>Thu 8:00 am - 4:00 pm<br>Fri 8:00 am - 4:00 pm<br>Sat Closed<br>Sun Closed<br>,,,,,,,,,,,,,,,,,,,,,,,,,,,"Signmaking, Graphic Design, Signmaking, Graphic Design",41.906829,-88.022939,"https://s3-media1.fl.yelpcdn.com/bphoto/X_dYmmkOc5589oXKsFgbxw/ls.jpg"" srcset=""https://s3-media1.fl.yelpcdn.com/bphoto/X_dYmmkOc5589oXKsFgbxw/258s.jpg 1.03x,https://s3-media1.fl.yelpcdn.com/bphoto/X_dYmmkOc5589oXKsFgbxw/348s.jpg 1.39x,https://s3-media1.fl.yelpcdn.com/bphoto/X_dYmmkOc5589oXKsFgbxw/300s.jpg 1.20x",http://www.yelp.com/biz/sign-co-plus-lombard-2?osq=Signmaking,,,,,,,,,,
