Name,Street Address,City,State,Zip Code,Cross Streets,Neighborhood,Phone,Description,Business Owner,Merchant Verified,Paid Listing,Rating,Reviews,Website,Price Range,Hours,Takes Reservations,Delivery,Take Out,Accepts Credit Cards,Good For,Parking,Wheelchair Accessable,Good For Kids,Good For Groups,Attire,Ambience,Noise Level,Music,Dancing,Serves Alcohol,Happy Hour,Best Nights,Coat Check,Smoking Allowed,Outdoor Seating,Wifi,Has Tv,Allows Dogs,Waiter Service,Caters,By Appointment Only,Category,Lat,Long,Image URL,Listing URL,Deal,Deal Description,Deal Orignal Price,Deal Discount,Deal Savings,Deal Link,Email from Web,Facebook URL,Twitter URL,Google Plus URL
FedEx Office Print & Ship Center,5240 N Pulaski Rd Ste H,Chicago,IL,60630,at Foster Ave,North Park,(773) 478-0919,"FedEx Office in Chicago, IL provides a one-stop shop for small businesses printing and shipping expertise and reliable customer service when and where you need it. Services include …Learn more about FedEx Office Print & Ship Center, Opens a popupSpecialtiesFedEx Office in Chicago, IL provides a one-stop shop for small businesses printing and shipping expertise and reliable customer service when and where you need it. Services include copying and digital printing, direct mail, signs and graphics, Internet access, computer rental, fax services, passport photos, FedEx Express and FedEx Ground shipping.Upload documents with FedEx Office Print Online, and have your flyers, brochures, presentations or signs ready for convenient pick-up or delivery.FedEx Kinko's is now FedEx Office.HistoryEstablished in 1970.FedEx Office (formerly FedEx Kinko's) provides access points to printing and shipping expertise with reliable service when and where you need it. The Dallas-based company has a network of more than 1,900 digitally-connected locations.FedEx Office services include copying and digital printing, professional finishing, document creation, direct mail, signs and graphics, Internet access, computer rental, FedEx Express and FedEx Ground shipping, and more.In addition, the company offers FedEx Office Print Online, an online printing solution for business and personal printing, at home, at the office or on the go.More than 200 locations operate 24 hours a day every day of the week.",,Yes,No,2.5 star rating,31 reviews,http://local.fedex.com/il/chicago/office-2051/%3Fcmp%3DLOC-1001545-3-1-971-1110000-US-US-EN-YEXTLISTFXOPRSC,,Mon 7:30 am - 9:00 pm<br>Tue 7:30 am - 9:00 pm<br>Wed 7:30 am - 9:00 pm<br>Thu 7:30 am - 9:00 pm<br>Fri 7:30 am - 9:00 pm<br>Sat 8:00 am - 6:00 pm<br>Sun 12:00 pm - 6:00 pm<br>,,,,Yes,,,,,,,,,,,,,,,,,,,,,,,"Printing Services, Shipping Centers, Signmaking, Printing Services, Shipping Centers, Signmaking",41.976910,-87.729081,"https://s3-media1.fl.yelpcdn.com/bphoto/FUNCHh1HJRmyfVRpmDb4PQ/ls.jpg"" srcset=""https://s3-media1.fl.yelpcdn.com/bphoto/FUNCHh1HJRmyfVRpmDb4PQ/258s.jpg 1.03x,https://s3-media1.fl.yelpcdn.com/bphoto/FUNCHh1HJRmyfVRpmDb4PQ/348s.jpg 1.39x,https://s3-media1.fl.yelpcdn.com/bphoto/FUNCHh1HJRmyfVRpmDb4PQ/300s.jpg 1.20x",http://www.yelp.com/biz/fedex-office-print-and-ship-center-chicago-10?osq=Signmaking,,,,,,,,,,
Ed’s Signs,6418 N Central Ave,Chicago,IL,60646,b/t Leoti Ave & Devon Ave,Forest Glen,(773) 774-1168,,,Yes,No,,,,,,,,,,,,,,,,,,,,,,,,,,,,,,,,"Print Media, Signmaking, Screen Printing, Print Media, Signmaking, Screen Printing",41.997992,-87.763588,,http://www.yelp.com/biz/eds-signs-chicago?osq=Signmaking,,,,,,,,,,
FedEx Office Ship Center,2 N Lasalle St,Chicago,IL,60602,,The Loop,(312) 341-2931,,,Yes,No,3.0 star rating,5 reviews,http://local.fedex.com/il/chicago/office-4529/%3Fcmp%3DLOC-1001545-3-1-971-1110000-US-US-EN-YEXTLISTFXOSHIP,,Mon 7:30 am - 7:30 pm<br>Tue 7:30 am - 7:30 pm<br>Wed 7:30 am - 7:30 pm<br>Thu 7:30 am - 7:30 pm<br>Fri 7:30 am - 7:30 pm<br>Sat Closed<br>Sun Closed<br>,,,,Yes,,,,,,,,,,,,,,,,,,,,,,,"Shipping Centers, Printing Services, Signmaking, Shipping Centers, Printing Services, Signmaking",41.882050,-87.632695,"https://s3-media1.fl.yelpcdn.com/bphoto/f_DZef-oQfPed4k-V_KVrg/ls.jpg"" srcset=""https://s3-media1.fl.yelpcdn.com/bphoto/f_DZef-oQfPed4k-V_KVrg/258s.jpg 1.03x,https://s3-media1.fl.yelpcdn.com/bphoto/f_DZef-oQfPed4k-V_KVrg/348s.jpg 1.39x,https://s3-media1.fl.yelpcdn.com/bphoto/f_DZef-oQfPed4k-V_KVrg/300s.jpg 1.20x",http://www.yelp.com/biz/fedex-office-ship-center-chicago-8?osq=Signmaking,,,,,,,,,,
Sign Edge,6501 Pershing Rd,Stickney,IL,60402,,,(708) 788-2727,,,Yes,No,5.0 star rating,3 reviews,http://www.thesignedge.com/,,Mon 10:00 am - 4:00 pm<br>Tue 10:00 am - 4:00 pm<br>Wed 10:00 am - 4:00 pm<br>Thu 10:00 am - 4:00 pm<br>Fri 10:00 am - 4:00 pm<br>Sat Closed<br>Sun Closed<br>,,,,,,,,,,,,,,,,,,,,,,,,,,,"Graphic Design, Signmaking, Graphic Design, Signmaking",41.821148,-87.785329,"https://s3-media4.fl.yelpcdn.com/bphoto/By_dcYGFriZ7cB3coZn__A/ls.jpg"" srcset=""https://s3-media4.fl.yelpcdn.com/bphoto/By_dcYGFriZ7cB3coZn__A/258s.jpg 1.03x,https://s3-media4.fl.yelpcdn.com/bphoto/By_dcYGFriZ7cB3coZn__A/348s.jpg 1.39x,https://s3-media4.fl.yelpcdn.com/bphoto/By_dcYGFriZ7cB3coZn__A/300s.jpg 1.20x",http://www.yelp.com/biz/sign-edge-stickney?osq=Signmaking,,,,,,,signedgemail@aol.com,,,
SpeedPro Chicago Loop,2028 S Michigan Ave Ste 101,Chicago,IL,60616,b/t Cullerton St & 21st St,Near Southside,(312) 651-4208,,Eric L.,Yes,No,5.0 star rating,2 reviews,http://www.speedpro.com/locations/chicago-loop/,,Mon 9:00 am - 5:00 pm<br>Tue 9:00 am - 5:00 pm<br>Wed 9:00 am - 5:00 pm<br>Thu 9:00 am - 5:00 pm<br>Fri 9:00 am - 5:00 pm<br>Sat Closed<br>Sun Closed<br>,,,,Yes,,,,,,,,,,,,,,,,,,,,,,,"Printing Services, Signmaking, Vehicle Wraps, Printing Services, Signmaking, Vehicle Wraps",,,"https://s3-media3.fl.yelpcdn.com/bphoto/9dAZRSjwhaOEQP2ZZgwQeQ/ls.jpg"" srcset=""https://s3-media3.fl.yelpcdn.com/bphoto/9dAZRSjwhaOEQP2ZZgwQeQ/258s.jpg 1.03x,https://s3-media3.fl.yelpcdn.com/bphoto/9dAZRSjwhaOEQP2ZZgwQeQ/348s.jpg 1.39x,https://s3-media3.fl.yelpcdn.com/bphoto/9dAZRSjwhaOEQP2ZZgwQeQ/300s.jpg 1.20x",http://www.yelp.com/biz/speedpro-chicago-loop-chicago?osq=Signmaking,,,,,,,,,,
Spellbrite LED Signage System,118 S Clinton St Ste 370,Chicago,IL,60661,b/t Washington Blvd & Randolph St,"West Loop, Near West Side",(312) 575-9620,,,Yes,No,,,https://www.SpellBrite.com/,,Mon 8:00 am - 5:00 pm<br>Tue 8:00 am - 5:00 pm<br>Wed 8:00 am - 5:00 pm<br>Thu 8:00 am - 5:00 pm<br>Fri 8:00 am - 5:00 pm<br>Sat Closed<br>Sun Closed<br>,,,,,,,,,,,,,,,,,,,,,,,,,,,"Signmaking, Signmaking",41.879990,-87.641510,"https://s3-media3.fl.yelpcdn.com/bphoto/EqyupJ9O9j11OnI4baou2Q/ls.jpg"" srcset=""https://s3-media3.fl.yelpcdn.com/bphoto/EqyupJ9O9j11OnI4baou2Q/258s.jpg 1.03x,https://s3-media3.fl.yelpcdn.com/bphoto/EqyupJ9O9j11OnI4baou2Q/348s.jpg 1.39x,https://s3-media3.fl.yelpcdn.com/bphoto/EqyupJ9O9j11OnI4baou2Q/300s.jpg 1.20x",http://www.yelp.com/biz/spellbrite-led-signage-system-chicago?osq=Signmaking,,,,,,,info@spellbrite.com,,,
Independent Neon & Signs,1810 W Irving Park,Chicago,IL,60613,at Ravenswood Ave,"North Center, Lakeview",(773) 248-1969,,,Yes,No,4.0 star rating,11 reviews,http://indysignschicago.com/,,Mon 9:00 am - 5:00 pm<br>Tue 9:00 am - 5:00 pm<br>Wed 9:00 am - 5:00 pm<br>Thu 9:00 am - 5:00 pm<br>Fri 9:00 am - 5:00 pm<br>Sat 9:00 am - 1:00 pm<br>Sun Closed<br>,,,,,,,,,,,,,,,,,,,,,,,,,,,"Signmaking, Signmaking",41.954443,-87.674564,"https://s3-media3.fl.yelpcdn.com/bphoto/kKRHpoXEZuh2lDkHx8rPDA/ls.jpg"" srcset=""https://s3-media3.fl.yelpcdn.com/bphoto/kKRHpoXEZuh2lDkHx8rPDA/258s.jpg 1.03x,https://s3-media3.fl.yelpcdn.com/bphoto/kKRHpoXEZuh2lDkHx8rPDA/348s.jpg 1.39x,https://s3-media3.fl.yelpcdn.com/bphoto/kKRHpoXEZuh2lDkHx8rPDA/300s.jpg 1.20x",http://www.yelp.com/biz/independent-neon-and-signs-chicago?osq=Signmaking,,,,,,,,,,
Premier Signs & Awnings,6510 N Clark St,Chicago,IL,60626,at Arthur Ave,Rogers Park,(773) 338-1555,,,No,No,,,,,Mon 9:00 am - 6:00 pm<br>Tue 9:00 am - 6:00 pm<br>Wed 9:00 am - 6:00 pm<br>Thu 9:00 am - 6:00 pm<br>Fri 9:00 am - 6:00 pm<br>Sat 9:00 am - 2:00 pm<br>Sun Closed<br>,,,,,,,,,,,,,,,,,,,,,,,,,,,"Signmaking, Graphic Design, Signmaking, Graphic Design",42.000290,-87.671572,,http://www.yelp.com/biz/premier-signs-and-awnings-chicago?osq=Signmaking,,,,,,,,,,
Hernandez Signs,4049 West Ogden Ave,Chicago,IL,60623,b/t Pulaski Rd & Kedvale Ave,Lawndale,(773) 823-7006,,,Yes,No,4.0 star rating,4 reviews,http://www.hernandezsignsawnings.com,,Mon 9:00 am - 5:00 pm<br>Tue 9:00 am - 5:00 pm<br>Wed 9:00 am - 5:00 pm<br>Thu 9:00 am - 5:00 pm<br>Fri 9:00 am - 5:00 pm<br>Sat Closed<br>Sun Closed<br>,,,,No,,,,,,,,,,,,,,,,,,,,,,,"Signmaking, Awnings, Signmaking, Awnings",41.850682,-87.725859,,http://www.yelp.com/biz/hernandez-signs-chicago?osq=Signmaking,,,,,,,hernandezsigns@comcast.net,,,
FedEx Office Print & Ship Center,222 Merchandise Mart Plz Ste 202,Chicago,IL,60654,b/t Orleans St & Lower Orleans St,"River North, Near North Side",(312) 755-1088,,,Yes,No,4.0 star rating,6 reviews,http://local.fedex.com/il/chicago/office-2360/%3Fcmp%3DLOC-1001545-3-1-971-1110000-US-US-EN-YEXTLISTFXOPRSC,,Mon 7:30 am - 9:00 pm<br>Tue 7:30 am - 9:00 pm<br>Wed 7:30 am - 9:00 pm<br>Thu 7:30 am - 9:00 pm<br>Fri 7:30 am - 9:00 pm<br>Sat 8:00 am - 6:00 pm<br>Sun Closed<br>,,,,Yes,,,,,,,,,,,,,,,,,,,,,,,"Shipping Centers, Printing Services, Signmaking, Shipping Centers, Printing Services, Signmaking",41.888595,-87.634614,"https://s3-media1.fl.yelpcdn.com/bphoto/tgpQRX5A_bnVXH5v8kNaRQ/ls.jpg"" srcset=""https://s3-media1.fl.yelpcdn.com/bphoto/tgpQRX5A_bnVXH5v8kNaRQ/258s.jpg 1.03x,https://s3-media1.fl.yelpcdn.com/bphoto/tgpQRX5A_bnVXH5v8kNaRQ/348s.jpg 1.39x,https://s3-media1.fl.yelpcdn.com/bphoto/tgpQRX5A_bnVXH5v8kNaRQ/300s.jpg 1.20x",http://www.yelp.com/biz/fedex-office-print-and-ship-center-chicago-26?osq=Signmaking,,,,,,,,,,
AOKO Studio,2850 N Pulaski Rd,Chicago,IL,60641,at George St,Avondale,(312) 888-6592,,,Yes,No,5.0 star rating,1 review,http://www.aoko.us,,Mon 10:00 am - 9:00 pm<br>Tue 10:00 am - 9:00 pm<br>Wed 10:00 am - 9:00 pm<br>Thu 10:00 am - 9:00 pm<br>Fri 10:00 am - 9:00 pm<br>Sat Closed<br>Sun Closed<br>,,,,Yes,,,,,,,,,,,,,,,,,,,,,,,"Engraving, Signmaking, Customized Merchandise, Engraving, Signmaking, Customized Merchandise",41.933166,-87.727685,"https://s3-media3.fl.yelpcdn.com/bphoto/41R6XaHH176bSJZtMpC3hg/ls.jpg"" srcset=""https://s3-media3.fl.yelpcdn.com/bphoto/41R6XaHH176bSJZtMpC3hg/258s.jpg 1.03x,https://s3-media3.fl.yelpcdn.com/bphoto/41R6XaHH176bSJZtMpC3hg/348s.jpg 1.39x,https://s3-media3.fl.yelpcdn.com/bphoto/41R6XaHH176bSJZtMpC3hg/300s.jpg 1.20x",http://www.yelp.com/biz/aoko-studio-chicago?osq=Signmaking,,,,,,,sales@aoko.us,,,
Lightbox Graphix,1894 S Elmhurst Rd,Mount Prospect,IL,60056,,,(630) 715-1849,,Danny C.,Yes,No,5.0 star rating,2 reviews,http://lightboxgraphix.com,,Mon 8:30 am - 5:00 pm<br>Tue 8:30 am - 5:00 pm<br>Wed 8:30 am - 5:00 pm<br>Thu 8:30 am - 5:00 pm<br>Fri 8:30 am - 5:00 pm<br>Sat Closed<br>Sun Closed<br>,,,,Yes,,,,,,,,,,,,,,,,,,,,,,,"Signmaking, Vehicle Wraps, Graphic Design, Signmaking, Vehicle Wraps, Graphic Design",,,"https://s3-media4.fl.yelpcdn.com/bphoto/rv_ARuj85eOCeHUeQg8vuQ/ls.jpg"" srcset=""https://s3-media4.fl.yelpcdn.com/bphoto/rv_ARuj85eOCeHUeQg8vuQ/258s.jpg 1.03x,https://s3-media4.fl.yelpcdn.com/bphoto/rv_ARuj85eOCeHUeQg8vuQ/348s.jpg 1.39x,https://s3-media4.fl.yelpcdn.com/bphoto/rv_ARuj85eOCeHUeQg8vuQ/300s.jpg 1.20x",http://www.yelp.com/biz/lightbox-graphix-mount-prospect?osq=Signmaking,,,,,,,info@lightboxgraphix.com,,,
Rb Signs,4543 W Addison St,Chicago,IL,60641,b/t Kolmar Ave & Kilbourn Ave,Portage Park,(773) 736-0800,,,Yes,No,,,http://rbsigns.com,,,,,,,,,,,,,,,,,,,,,,,,,,,,,"Signmaking, Signmaking",41.946127,-87.741582,,http://www.yelp.com/biz/rb-signs-chicago?osq=Signmaking,,,,,,,,,,
Nelson-Harkins,,Chicago,IL,60290,,Pilsen,(800) 882-8989,,,No,No,,,http://nelson-harkins.com,,Mon 7:00 am - 5:00 pm<br>Tue 7:00 am - 5:00 pm<br>Wed 7:00 am - 5:00 pm<br>Thu 7:00 am - 5:00 pm<br>Fri 7:00 am - 5:00 pm<br>Sat Closed<br>Sun Closed<br>,,,,,,,,,,,,,,,,,,,,,,,,,,,"Signmaking, Signmaking",,,,http://www.yelp.com/biz/nelson-harkins-chicago?osq=Signmaking,,,,,,,,,,
Southwest Signs,5641 W 63rd St,Chicago,IL,60638,b/t Parkside Ave & Major Ave,Clearing,(773) 585-3530,,Charles W.,Yes,No,,,http://www.southwestsignschicago.com,,Mon 9:00 am - 6:00 pm<br>Tue 8:30 am - 6:00 pm<br>Wed 8:30 am - 5:00 pm<br>Thu 9:00 am - 6:00 pm<br>Fri 9:00 am - 5:00 pm<br>Sat Closed<br>Sun Closed<br>,,,,,,,,,,,,,,,,,,,,,,,,,,,"Signmaking, Signmaking",41.777760,-87.763335,"https://s3-media2.fl.yelpcdn.com/bphoto/napI-rROwjtqB_CGpVotAw/ls.jpg"" srcset=""https://s3-media2.fl.yelpcdn.com/bphoto/napI-rROwjtqB_CGpVotAw/258s.jpg 1.03x,https://s3-media2.fl.yelpcdn.com/bphoto/napI-rROwjtqB_CGpVotAw/348s.jpg 1.39x,https://s3-media2.fl.yelpcdn.com/bphoto/napI-rROwjtqB_CGpVotAw/300s.jpg 1.20x",http://www.yelp.com/biz/southwest-signs-chicago?osq=Signmaking,,,,,,,,,,
Drip Graphics,,Chicago,IL,60101,,,(630) 317-4230,,,Yes,No,,,http://www.wearedrip.com/,,,,,,,,,,,,,,,,,,,,,,,,,,,,,"Signmaking, Marketing, Graphic Design, Signmaking, Marketing, Graphic Design",,,"https://s3-media3.fl.yelpcdn.com/bphoto/M1rklVv4CA7EtY7H7mcD4Q/ls.jpg"" srcset=""https://s3-media3.fl.yelpcdn.com/bphoto/M1rklVv4CA7EtY7H7mcD4Q/258s.jpg 1.03x,https://s3-media3.fl.yelpcdn.com/bphoto/M1rklVv4CA7EtY7H7mcD4Q/348s.jpg 1.39x,https://s3-media3.fl.yelpcdn.com/bphoto/M1rklVv4CA7EtY7H7mcD4Q/300s.jpg 1.20x",http://www.yelp.com/biz/drip-graphics-chicago?osq=Signmaking,,,,,,,,,,
Ink Your Wear,3232 Harlem Ave,Riverside,IL,60546,,,(708) 329-4444,,,Yes,No,5.0 star rating,1 review,http://www.inkyourwear.com,,Mon 10:00 am - 5:00 pm<br>Tue 10:00 am - 5:00 pm<br>Wed 10:00 am - 5:00 pm<br>Thu 10:00 am - 5:00 pm<br>Fri 10:00 am - 5:00 pm<br>Sat Closed<br>Sun Closed<br>,,,,Yes,,Street,Yes,,,,,,,,,,,,,,,,Yes,,,,"Screen Printing/T-Shirt Printing, Signmaking, Embroidery & Crochet, Screen Printing/T-Shirt Printing, Signmaking, Embroidery & Crochet",41.832979,-87.803238,"https://s3-media2.fl.yelpcdn.com/bphoto/PSw1zWNuIDDsBX73C1D-mA/ls.jpg"" srcset=""https://s3-media2.fl.yelpcdn.com/bphoto/PSw1zWNuIDDsBX73C1D-mA/258s.jpg 1.03x,https://s3-media2.fl.yelpcdn.com/bphoto/PSw1zWNuIDDsBX73C1D-mA/348s.jpg 1.39x,https://s3-media2.fl.yelpcdn.com/bphoto/PSw1zWNuIDDsBX73C1D-mA/300s.jpg 1.20x",http://www.yelp.com/biz/ink-your-wear-riverside-2?osq=Signmaking,$10 for $20 Deal at Ink Your Wear,You get a voucher redeemable for $20 at Ink Your Wear.,$20,50%,$10,https://www.yelp.com/checkout/deal/6BDYHPLYzUB2Tp0tnbiRjA?biz_id=oHTI3N_vfzUx-PM7AxGpkQ&return_url=%2Fbiz%2Fink-your-wear-riverside-2,,,,
FedEx Office Ship Center,130 E Randolph,Chicago,IL,60601,b/t Stetson Ave & Beaubien Ct,Pilsen,(312) 616-8020,,,Yes,No,3.5 star rating,2 reviews,http://local.fedex.com/il/chicago/office-4530/%3Fcmp%3DLOC-1001545-3-1-971-1110000-US-US-EN-YEXTLISTFXOSHIP,,Mon 7:30 am - 7:30 pm<br>Tue 7:30 am - 7:30 pm<br>Wed 7:30 am - 7:30 pm<br>Thu 7:30 am - 7:30 pm<br>Fri 7:30 am - 7:30 pm<br>Sat Closed<br>Sun Closed<br>,,,,,,,,,,,,,,,,,,,,,,,,,,,"Shipping Centers, Printing Services, Signmaking, Shipping Centers, Printing Services, Signmaking",41.853069,-87.650000,"https://s3-media1.fl.yelpcdn.com/bphoto/52VWwrR2z5v_LMxNaa9ZcA/ls.jpg"" srcset=""https://s3-media1.fl.yelpcdn.com/bphoto/52VWwrR2z5v_LMxNaa9ZcA/258s.jpg 1.03x,https://s3-media1.fl.yelpcdn.com/bphoto/52VWwrR2z5v_LMxNaa9ZcA/348s.jpg 1.39x,https://s3-media1.fl.yelpcdn.com/bphoto/52VWwrR2z5v_LMxNaa9ZcA/300s.jpg 1.20x",http://www.yelp.com/biz/fedex-office-ship-center-chicago-6?osq=Signmaking,,,,,,,,,,
Same Day Tee Shirts,1326 W Washington Blvd Ste 200,Chicago,IL,60607,b/t Loomis St & Ada St,"Near West Side, West Loop",(312) 664-6150,,,No,No,,,http://www.samedayteeshirts.com,,Mon 9:00 am - 5:00 pm<br>Tue 9:00 am - 5:00 pm<br>Wed 9:00 am - 5:00 pm<br>Thu 9:00 am - 5:00 pm<br>Fri 9:00 am - 5:00 pm<br>Sat Closed<br>Sun Closed<br>,,,,,,,,,,,,,,,,,,,,,,,,,,,"Screen Printing/T-Shirt Printing, Marketing, Signmaking, Screen Printing/T-Shirt Printing, Marketing, Signmaking",41.883243,-87.660809,,http://www.yelp.com/biz/same-day-tee-shirts-chicago-2?osq=Signmaking,,,,,,,,,,
FedEx Office Print & Ship Center,127 S Clinton St,Chicago,IL,60661,b/t Washington Blvd & Randolph St,"West Loop, Near West Side",(312) 559-1324,"FedEx Office in Chicago, IL provides a one-stop shop for small businesses printing and shipping expertise and reliable customer service when and where you need it. Services include …Learn more about FedEx Office Print & Ship Center, Opens a popupSpecialtiesFedEx Office in Chicago, IL provides a one-stop shop for small businesses printing and shipping expertise and reliable customer service when and where you need it. Services include copying and digital printing, direct mail, signs and graphics, Internet access, computer rental, fax services, passport photos, FedEx Express and FedEx Ground shipping.Upload documents with FedEx Office Print Online, and have your flyers, brochures, presentations or signs ready for convenient pick-up or delivery.FedEx Kinko's is now FedEx Office.HistoryEstablished in 1970.FedEx Office (formerly FedEx Kinko's) provides access points to printing and shipping expertise with reliable service when and where you need it. The Dallas-based company has a network of more than 1,900 digitally-connected locations.FedEx Office services include copying and digital printing, professional finishing, document creation, direct mail, signs and graphics, Internet access, computer rental, FedEx Express and FedEx Ground shipping, and more.In addition, the company offers FedEx Office Print Online, an online printing solution for business and personal printing, at home, at the office or on the go.More than 200 locations operate 24 hours a day every day of the week.",,Yes,No,3.5 star rating,17 reviews,http://local.fedex.com/il/chicago/office-1000/%3Fcmp%3DLOC-1001545-3-1-971-1110000-US-US-EN-YEXTLISTFXOPRSC,,Mon 7:30 am - 9:00 pm<br>Tue 7:30 am - 9:00 pm<br>Wed 7:30 am - 9:00 pm<br>Thu 7:30 am - 9:00 pm<br>Fri 7:30 am - 9:00 pm<br>Sat 8:00 am - 6:00 pm<br>Sun Closed<br>,,,,Yes,,,,,,,,,,,,,,,,,,,,,,,"Shipping Centers, Printing Services, Signmaking, Shipping Centers, Printing Services, Signmaking",41.879709,-87.640933,"https://s3-media4.fl.yelpcdn.com/bphoto/xSnJZi-U04h1SUazaM2m4w/ls.jpg"" srcset=""https://s3-media4.fl.yelpcdn.com/bphoto/xSnJZi-U04h1SUazaM2m4w/258s.jpg 1.03x,https://s3-media4.fl.yelpcdn.com/bphoto/xSnJZi-U04h1SUazaM2m4w/348s.jpg 1.39x,https://s3-media4.fl.yelpcdn.com/bphoto/xSnJZi-U04h1SUazaM2m4w/300s.jpg 1.20x",http://www.yelp.com/biz/fedex-office-print-and-ship-center-chicago-24?osq=Signmaking,,,,,,,,,,
Widaman Sign Company,6815 Ogden Ave,Berwyn,IL,60402,,,(708) 788-9080,,,Yes,No,5.0 star rating,3 reviews,,,,,,,,,,,,,,,,,,,,,,,,,,,,,,"Signmaking, Signmaking",41.827318,-87.793404,"https://s3-media1.fl.yelpcdn.com/bphoto/NiFZoxhWqgd2Rm9r3_WJ6w/ls.jpg"" srcset=""https://s3-media1.fl.yelpcdn.com/bphoto/NiFZoxhWqgd2Rm9r3_WJ6w/258s.jpg 1.03x,https://s3-media1.fl.yelpcdn.com/bphoto/NiFZoxhWqgd2Rm9r3_WJ6w/348s.jpg 1.39x,https://s3-media1.fl.yelpcdn.com/bphoto/NiFZoxhWqgd2Rm9r3_WJ6w/300s.jpg 1.20x",http://www.yelp.com/biz/widaman-sign-company-berwyn?osq=Signmaking,,,,,,,,,,
Signarama,8088 Mccormick Blvd,Skokie,IL,60076,b/t Oakton St & Cleveland St,,(847) 324-5500,,,Yes,No,5.0 star rating,1 review,http://www.signarama.com/il-skokie,,Mon 9:00 am - 5:30 pm<br>Tue 9:00 am - 5:30 pm<br>Wed 9:00 am - 5:30 pm<br>Thu 9:00 am - 5:30 pm<br>Fri 9:00 am - 5:30 pm<br>Sat Closed<br>Sun Closed<br>,,,,Yes,,,,,,,,,,,,,,,,,,,,,,,"Signmaking, Graphic Design, Vehicle Wraps, Signmaking, Graphic Design, Vehicle Wraps",,,"https://s3-media4.fl.yelpcdn.com/bphoto/_TWIwKhPinbqqJs81z0atg/ls.jpg"" srcset=""https://s3-media4.fl.yelpcdn.com/bphoto/_TWIwKhPinbqqJs81z0atg/258s.jpg 1.03x,https://s3-media4.fl.yelpcdn.com/bphoto/_TWIwKhPinbqqJs81z0atg/348s.jpg 1.39x,https://s3-media4.fl.yelpcdn.com/bphoto/_TWIwKhPinbqqJs81z0atg/300s.jpg 1.20x",http://www.yelp.com/biz/signarama-skokie-5?osq=Signmaking,,,,,,,,,,
FedEx Office Print & Ship Center,7217 W Forest Preserve Ave,Norridge,IL,60706,b/t Octavia Ave & Illinois Route 43,Dunning,(708) 456-5737,"FedEx Office in Norridge, IL provides a one-stop shop for small businesses printing and shipping expertise and reliable customer service when and where you need it. Services include …Learn more about FedEx Office Print & Ship Center, Opens a popupSpecialtiesFedEx Office in Norridge, IL provides a one-stop shop for small businesses printing and shipping expertise and reliable customer service when and where you need it. Services include copying and digital printing, direct mail, signs and graphics, Internet access, computer rental, fax services, passport photos, FedEx Express and FedEx Ground shipping.Upload documents with FedEx Office Print Online, and have your flyers, brochures, presentations or signs ready for convenient pick-up or delivery.FedEx Kinko's is now FedEx Office.HistoryEstablished in 1970.FedEx Office (formerly FedEx Kinko's) provides access points to printing and shipping expertise with reliable service when and where you need it. The Dallas-based company has a network of more than 1,900 digitally-connected locations.FedEx Office services include copying and digital printing, professional finishing, document creation, direct mail, signs and graphics, Internet access, computer rental, FedEx Express and FedEx Ground shipping, and more.In addition, the company offers FedEx Office Print Online, an online printing solution for business and personal printing, at home, at the office or on the go.More than 200 locations operate 24 hours a day every day of the week.",,Yes,No,2.5 star rating,19 reviews,http://local.fedex.com/il/norridge/office-0332/%3Fcmp%3DLOC-1001545-3-1-971-1110000-US-US-EN-YEXTLISTFXOPRSC,,Mon 7:30 am - 9:00 pm<br>Tue 7:30 am - 9:00 pm<br>Wed 7:30 am - 9:00 pm<br>Thu 7:30 am - 9:00 pm<br>Fri 7:30 am - 9:00 pm<br>Sat 8:00 am - 6:00 pm<br>Sun 12:00 pm - 6:00 pm<br>,,,,Yes,,,,,,,,,,,,,,,,,,,,,,,"Shipping Centers, Printing Services, Signmaking, Shipping Centers, Printing Services, Signmaking",41.953049,-87.808065,"https://s3-media2.fl.yelpcdn.com/bphoto/x61AE-gjs6C1XllmTj0xXw/ls.jpg"" srcset=""https://s3-media2.fl.yelpcdn.com/bphoto/x61AE-gjs6C1XllmTj0xXw/258s.jpg 1.03x,https://s3-media2.fl.yelpcdn.com/bphoto/x61AE-gjs6C1XllmTj0xXw/348s.jpg 1.39x,https://s3-media2.fl.yelpcdn.com/bphoto/x61AE-gjs6C1XllmTj0xXw/300s.jpg 1.20x",http://www.yelp.com/biz/fedex-office-print-and-ship-center-norridge?osq=Signmaking,,,,,,,,,,
Jamaili Kopy Kat Printing,2501 Saint Charles Rd,Bellwood,IL,60104,,,(708) 544-6164,,Dawood B.,Yes,No,3.0 star rating,2 reviews,,,Mon 9:00 am - 5:30 pm<br>Tue 9:00 am - 5:30 pm<br>Wed 9:00 am - 5:30 pm<br>Thu 9:00 am - 5:30 pm<br>Fri 9:00 am - 5:30 pm<br>Sat Closed<br>Sun Closed<br>,,,,Yes,,,,,,,,,,,,,,,,,,,,,,,"Printing Services, Graphic Design, Signmaking, Printing Services, Graphic Design, Signmaking",41.888204,-87.864013,"https://s3-media2.fl.yelpcdn.com/bphoto/FJniVjt-VNhGd8Jl7rNgzQ/ls.jpg"" srcset=""https://s3-media2.fl.yelpcdn.com/bphoto/FJniVjt-VNhGd8Jl7rNgzQ/258s.jpg 1.03x,https://s3-media2.fl.yelpcdn.com/bphoto/FJniVjt-VNhGd8Jl7rNgzQ/348s.jpg 1.39x,https://s3-media2.fl.yelpcdn.com/bphoto/FJniVjt-VNhGd8Jl7rNgzQ/300s.jpg 1.20x",http://www.yelp.com/biz/jamaili-kopy-kat-printing-bellwood?osq=Signmaking,,,,,,,,,,
ABC Stork Etc Lawn Sign Rental,5124 Dobson St,Skokie,IL,60077,b/t Leclaire Ave & Laramie Ave,,(847) 676-1207,,,Yes,No,4.5 star rating,6 reviews,,,Mon 6:30 am - 9:00 pm<br>Tue 6:30 am - 9:00 pm<br>Wed 6:30 am - 9:00 pm<br>Thu 6:30 am - 9:00 pm<br>Fri 6:30 am - 9:00 pm<br>Sat 6:30 am - 9:00 pm<br>Sun 6:30 am - 9:00 pm<br>,,,,,,,,,,,,,,,,,,,,,,,,,,,"Signmaking, Signmaking",42.020254,-87.755995,"https://s3-media3.fl.yelpcdn.com/bphoto/XqLKvoYfSyli5l5nErj3Cg/ls.jpg"" srcset=""https://s3-media3.fl.yelpcdn.com/bphoto/XqLKvoYfSyli5l5nErj3Cg/258s.jpg 1.03x,https://s3-media3.fl.yelpcdn.com/bphoto/XqLKvoYfSyli5l5nErj3Cg/348s.jpg 1.39x,https://s3-media3.fl.yelpcdn.com/bphoto/XqLKvoYfSyli5l5nErj3Cg/300s.jpg 1.20x",http://www.yelp.com/biz/abc-stork-etc-lawn-sign-rental-skokie?osq=Signmaking,,,,,,,,,,
